833,833,833,833,Lung,2,0.75,"LAMP3,SLC34A2,NKX2-1",Alveolar Type II,type II pneumocyte,CL:0002063,epithelial cell,"Signaling Alveolar Epithelial Type 2, Alveolar Epithelial Type 2","Alveolar Epithelial Type 2, Club",Alveolar Epithelial Type 2,"Alveolar Epithelial Type 1, Signaling Alveolar Epithelial Type 2, Club"
834,834,834,834,Lung,2,0.75,"CR2,FAS,CD1c",B cell_memory,memory B cell,CL:0000787,b cell,"Lymphatic, Adventitial Fibroblast, Alveolar Fibroblast","Alveolar Epithelial Type 1, CD4+ Memory/Effector T, Natural Killer T",Unidentified,"B, Plasma, Classical Monocyte"
835,835,835,835,Lung,2,0.75,"DNAI1,TUBA1A,HYDIN,FOXJ1,FAM92B,CDHR3",Ciliated Epithelial,ciliated epithelial cell,CL:0000067,epithelial cell,"Ciliated, Proximal Ciliated","Ciliated, Proximal Ciliated",Ciliated,"Ciliated, Proximal Ciliated"
836,836,836,836,Lung,2,0.75,"MUC5B,BPIFA1,SCGB3A1,SCGB3A2,SLPI",Club Epithelial,club cell,CL:0000158,epithelial cell,"Goblet, Mucous","Goblet, Mucous, Club",Mucous,"Goblet, Mucous, Serous, Club"
837,837,837,837,Lung,2,0.75,"COL3A1,COL1A1,COL6A1,COL6A2,IL33,COL6A3,FN1,COL5A2,COL18A1,SLIT2,DCN,COL1A2,IGFBP3,COL5A1,IL6,VIM,DDR2,HGF",Fibroblast,fibroblast,CL:0000057,fibroblast,"Ionocyte, Lymphatic, Adventitial Fibroblast, Alveolar Fibroblast, Lipofibroblast","Myofibroblast, Adventitial Fibroblast, Lipofibroblast, Ionocyte, Lymphatic",Fibroblast,"Myofibroblast, Adventitial Fibroblast, Alveolar Fibroblast, Lipofibroblast, IL33"
838,838,838,838,Lung,2,0.75,"CCL21,PROX1,MMRN1,RELN",Lymphatic Endothelial,endothelial cell of lymphatic vessel,CL:0002138,endothelial cell,Lymphatic,"Lymphatic, Vein",Lymphatic,"Lymphatic, Natural Killer, Proliferating Macrophage"
839,839,839,839,Lung,2,0.75,"LYVE1,MSR1,MERTK,SLC11A1,CD36,MS4A4A,CD163,RBPJ,CSF1R,MR1,CD74,PTPRC,MS4A6A,CD163,C1QA",Macrophage,macrophage,CL:0000235,macrophage/monocyte,"Lymphatic, Macrophage, Proliferating Macrophage","Lymphatic, Macrophage, IGSF21+ Dendritic, Intermediate Monocyte, Alveolar Epithelial Type 2, Classical Monocyte",Macrophage,"Vascular Smooth Muscle, Lymphatic, Macrophage"
840,840,840,840,Lung,2,0.75,"FCER1A,TPSAB1,TPSB2,CD69",Mast Cell,mast cell,CL:0000097,granulocyte,Basophil/Mast,"Basophil/Mast 1, Basophil/Mast 2",Basophil/Mast,Basophil/Mast
841,841,841,841,Lung,2,0.75,"DES,PDGFRB,MCAM,MYO1B,ANPEP,PDGFRB",Pericyte,pericyte,CL:0000669,pericyte,"Vascular Smooth Muscle, Pericyte","Pericyte, Airway Smooth Muscle, OLR1+ Classical Monocyte",Pericyte,Pericyte
842,842,842,842,Lung,2,0.75,"PALLD,ACTN1,MYL9,TAGLN,VCL,MYOCD,CNN1,ACTA2,GUCY1B3,SMTN",Smooth Muscle,smooth muscle cell,CL:0000192,muscle cell,"Airway Smooth Muscle, Vascular Smooth Muscle","Alveolar Epithelial Type 1, Airway Smooth Muscle, Vascular Smooth Muscle",Smooth Muscle,Alveolar Epithelial Type 1
843,843,843,843,Lung,2,0.75,"CD69,NKG7,IL7R,TRAC,PTPRC,CD247,CD96,CD3E,THEMIS",T cell,T cell,CL:0000084,t/nk cell,"Natural Killer T, CD8+ Memory/Effector T","CD4+ Memory/Effector T, Natural Killer T, Natural Killer, CD8+ Memory/Effector T, Nonclassical Monocyte",T Cell,CD4+ Memory/Effector T
844,844,844,844,Lung,2,0.75,"CD300LG,LDB2,PTPRB,BACE2,VWF,NOSTRIN,EPHB4",Vascular Endothelial,endothelial cell of vascular tree,CL:0002139,endothelial cell,"Capillary, Bronchial Vessel 2","Capillary, Artery, Vein, Basophil/Mast 2",Lymphatic,Endothelial
845,845,845,845,Lung,2,0.75,"SFTPD,PGC,MUC1,SFTPA2,NAPSA,SLC34A2,HOPX",type ii pneumocyte,type II pneumocyte,CL:0002063,epithelial cell,"Alveolar Epithelial Type 2, Signaling Alveolar Epithelial Type 2","Alveolar Epithelial Type 2, Signaling Alveolar Epithelial Type 2",Alveolar Epithelial Type 2,Alveolar Epithelial Type 2
846,846,846,846,Lung,2,0.75,"MMP25,CXCR2,S100A12,MGAM,FCGR3B,MTND5P32,PROK2",neutrophil,neutrophil,CL:0000775,granulocyte,Classical Monocyte,"Classical Monocyte, OLR1+ Classical Monocyte",Classical Monocyte,Natural Killer
847,847,847,847,Lung,2,0.75,"CD3D,CXCR4,IL32,TRBC2,IL7R,CD3G,TRAC","cd4-positive, alpha-beta t cell","CD4-positive, alpha-beta T cell",CL:0000624,t/nk cell,CD8+ Memory/Effector T,"CD8+ Memory/Effector T, Natural Killer T, Alveolar Epithelial Type 1, CD4+ Memory/Effector T",T Cell,CD8+ Naive T
848,848,848,848,Lung,2,0.75,"NKG7,CD3D,GZMA,CCL5,CD3E,CCL4,IL32","cd8-positive, alpha-beta t cell","CD8-positive, alpha-beta T cell",CL:0000625,t/nk cell,"CD8+ Memory/Effector T, Natural Killer","CD8+ Memory/Effector T, Natural Killer T, Natural Killer, CD4+ Memory/Effector T",T Cell,Plasmacytoid Dendritic
849,849,849,849,Lung,2,0.75,"FGFBP2,GZMB,GNLY,PRF1,KLRB1,GZMA,KLRF1",nk cell,natural killer cell,CL:0000623,t/nk cell,Natural Killer,"Natural Killer, CD8+ Naive T, CD8+ Memory/Effector T, Natural Killer T",Natural Killer,CD8+ Memory/Effector T
850,850,850,850,Lung,2,0.75,"PLVAP,EXOC3L2,RBP5,CYTL1,SELE,ZNF385D,ADAMTS4",bronchial vessel endothelial cell,,,endothelial cell,Bronchial Vessel 1,"Bronchial Vessel 1, Lipofibroblast, Vein",Bronchial Vessel 1,Bronchial Vessel 1
851,851,851,851,Lung,2,0.75,"ACTG2,MYH11,CCN5,DES,ADRA2C,HSPB6,JPH2",smooth muscle cell,smooth muscle cell,CL:0000192,muscle cell,"Airway Smooth Muscle, Vascular Smooth Muscle","Airway Smooth Muscle, Vascular Smooth Muscle, Fibromyocyte",Airway Smooth Muscle,Bronchial Vessel 2
852,852,852,852,Lung,2,0.75,"MGP,SERPINF1,MFAP5,IGFBP6,MFAP4,DCN,FBLN1",adventitial cell,adventitial cell,CL:0002503,adventitial cell,Adventitial Fibroblast,"Artery, Vein, Alveolar Fibroblast, Adventitial Fibroblast, Lymphatic",Adventitial Fibroblast,Vein
853,853,853,853,Lung,2,0.75,"ACP5,MS4A7,VSIG4,APOE,APOC1,FABP4,MRC1",macrophage,macrophage,CL:0000235,macrophage/monocyte,"Macrophage, Proliferating Macrophage","Signaling Alveolar Epithelial Type 2, Macrophage, Proliferating Macrophage, TREM2+ Dendritic, Lipofibroblast",Macrophage,Ciliated
854,854,854,854,Lung,2,0.75,"CPA3,CD69,GATA2,HPGDS,VWA5A,RHEX,KIT",basophil,basophil,CL:0000767,granulocyte,"Basophil/Mast 1, Basophil/Mast 2","Basophil/Mast 1, Basophil/Mast 2, CD4+ Memory/Effector T, Natural Killer T",Basophil/Mast,Lymphatic
855,855,855,855,Lung,2,0.75,"COTL1,S100A9,S100A12,CD300E,FCN1,VCAN,VSIR",classical monocyte,classical monocyte,CL:0000860,macrophage/monocyte,"Classical Monocyte, OLR1+ Classical Monocyte","Bronchial Vessel 1, Basal, Mucous, Classical Monocyte, Nonclassical Monocyte, Intermediate Monocyte, OLR1+ Classical Monocyte",Classical Monocyte,Lipofibroblast
856,856,856,856,Lung,2,0.75,"MMRN2,CXCL12,SOX17,NOS1,SERPINE2,GJA5,SSTR1",endothelial cell of artery,endothelial cell of artery,CL:1000413,endothelial cell,Artery,"Artery, Bronchial Vessel 2, Adventitial Fibroblast, Classical Monocyte, OLR1+ Classical Monocyte",Artery,Natural Killer
857,857,857,857,Lung,2,0.75,"CAPS,TSPAN1,PIFO,TPPP3,RSPH1,C1orf194,C11orf88",lung ciliated cell,lung ciliated cell,CL:1000271,ciliated cell,"Ciliated, Proximal Ciliated","Ciliated, Proximal Ciliated, Platelet/Megakaryocyte",Ciliated,Pericyte
858,858,858,858,Lung,2,0.75,"CD1C,CLEC5A,S100B,PKIB,CST7,FCGR2B,CLEC10A",dendritic cell,dendritic cell,CL:0000451,dendritic cell,Myeloid Dendritic Type 2,"Myeloid Dendritic Type 1, Myeloid Dendritic Type 2, EREG+ Dendritic, Macrophage",Myeloid Dendritic Type 1,Macrophage
859,859,859,859,Lung,2,0.75,"CP,BPIFB1,MSMB,SCGB3A1,SCGB1A1,LCN2,TFF3",respiratory goblet cell,respiratory goblet cell,CL:0002370,epithelial cell,Mucous,"Ciliated, Goblet, Mucous, Macrophage, Platelet/Megakaryocyte",Mucous,Proliferating Macrophage
860,860,860,860,Lung,2,0.75,"PERP,ALDH3A1,KRT17,KRT5,S100A2,KRT19,IGFBP2",basal cell,basal cell,CL:0000646,stem cell,"Proximal Basal, Differentiating Basal, Proliferating Basal","Basal, Proximal Basal, Differentiating Basal, Proliferating Basal",Basal,Proliferating Basal
861,861,861,861,Lung,2,0.75,"IGHA2,IGHG3,MZB1,SPAG4,TNFRSF17,CD79A,DERL3",plasma cell,plasma cell,CL:0000786,b cell,Plasma,"Plasma, Plasmacytoid Dendritic",Plasma,Differentiating Basal
862,862,862,862,Lung,2,0.75,"PAX5,TNFRSF13C,CD79A,BLK,TNFRSF13B,LINC01781,IGHM",b cell,B cell,CL:0000236,b cell,B,B,B,Basal
863,863,863,863,Lung,2,0.75,"TCN1,PRR4,C6orf58,PRB1,LPO,PRB3,LINC01829",serous cell of epithelium of bronchus,serous cell of epithelium of bronchus,CL:1000331,secretory cell,Serous,Serous,Serous,Lymphatic
864,864,864,864,Lung,2,0.75,"FGL2,CD163,MS4A6A,HCLS1,CSF1R,LST1,MAFB",non-classical monocyte,non-classical monocyte,CL:0000875,macrophage/monocyte,"Myeloid Dendritic Type 2, IGSF21+ Dendritic, EREG+ Dendritic, Intermediate Monocyte, Nonclassical Monocyte","IGSF21+ Dendritic, EREG+ Dendritic, Classical Monocyte, Nonclassical Monocyte, Intermediate Monocyte",Mixed Monocyte/Dendritic,Ciliated
865,865,865,865,Lung,2,0.75,"SLC6A4,LRRC32,RAMP2,VWF,MT1M,FAM107A,FCN3",capillary endothelial cell,capillary endothelial cell,CL:0002144,endothelial cell,"Vein, Capillary","Vein, Capillary, Alveolar Epithelial Type 1, Capillary Intermediate 2, Artery",Vein,Mesothelial
866,866,866,866,Lung,2,0.75,"CLDN5,GNG11,IL1RL1,HPGD,EMCN,TIMP3,RAMP2",capillary aerocyte,,,epithelial cell,"Capillary Aerocyte, Capillary Intermediate 1","Capillary Aerocyte, Capillary Intermediate 1, Alveolar Epithelial Type 1, Pericyte, IGSF21+ Dendritic",Capillary Aerocyte,Myofibroblast
867,867,867,867,Lung,2,0.75,"PKDCC,ITLN2,NCKAP5,SCEL,UPK3B,MYRF,ST6GALNAC5",type i pneumocyte,type I pneumocyte,CL:0002062,epithelial cell,Alveolar Epithelial Type 1,Alveolar Epithelial Type 1,Alveolar Epithelial Type 1,Serous
868,868,868,868,Lung,2,0.75,"CLU,ACKR1,PRSS23,LIFR,C7,VWF,RAMP3",vein endothelial cell,vein endothelial cell,CL:0002543,endothelial cell,"Vein, Adventitial Fibroblast, Alveolar Fibroblast","Vein, Bronchial Vessel 1, Lymphatic, Myofibroblast, Fibromyocyte, Plasma, Neuroendocrine, Ciliated, Mucous",Vein,Alveolar Epithelial Type 1
869,869,869,869,Lung,2,0.75,"C7,ADH1B,FBLN1,LUM,DCN,MFAP4,C1S",alveolar fibroblast,,,fibroblast,"Adventitial Fibroblast, Alveolar Fibroblast","Adventitial Fibroblast, Alveolar Fibroblast, Vein",Adventitial Fibroblast,Alveolar Fibroblast
870,870,870,870,Lung,2,0.75,"STAB2,RELN,CCL21,SEMA3D,PROX1,GPR182,MMRN1",endothelial cell of lymphatic vessel,endothelial cell of lymphatic vessel,CL:0002138,endothelial cell,Lymphatic,Lymphatic,Lymphatic,Lymphatic
871,871,871,871,Lung,2,0.75,"DES,PLAC9,CRYAB,ACTG2,PLN,CNN1,LMOD1",bronchial smooth muscle cell,bronchial smooth muscle cell,CL:0002598,muscle cell,Airway Smooth Muscle,"Airway Smooth Muscle, Vascular Smooth Muscle, Fibromyocyte",Airway Smooth Muscle,Lymphatic
872,872,872,872,Lung,2,0.75,"AL139020.1,SPIB,LILRA4,LAMP5,AL357143.1,SCT,FAM129C",plasmacytoid dendritic cell,plasmacytoid dendritic cell,CL:0000784,dendritic cell,Plasmacytoid Dendritic,"B, Plasmacytoid Dendritic, Myofibroblast",Plasmacytoid Dendritic,Plasmacytoid Dendritic
873,873,873,873,Lung,2,0.75,"CEACAM6,SCGB3A2,PIGR,GPRC5A,CYP2B7P,WFDC2,NEDD4L",club cell,club cell,CL:0000158,epithelial cell,"Club, Goblet, Alveolar Epithelial Type 1, Signaling Alveolar Epithelial Type 2","Club, Goblet, Alveolar Epithelial Type 1, Signaling Alveolar Epithelial Type 2, Adventitial Fibroblast, Lipofibroblast",Club,"Signaling Alveolar Epithelial Type 2, Club, Goblet, Alveolar Epithelial Type 1"
874,874,874,874,Lung,2,0.75,"C7,CLDN5,SPARCL1,LIFR,VWF,IGFBP7,ACKR1",lung microvascular endothelial cell,lung microvascular endothelial cell,CL:2000016,endothelial cell,"Capillary, Vein","Vein, Bronchial Vessel 1, Adventitial Fibroblast, Alveolar Fibroblast, Lipofibroblast, Capillary Aerocyte, Capillary, Capillary Intermediate 1, Platelet/Megakaryocyte, OLR1+ Classical Monocyte",Vein,"Vascular Smooth Muscle, Bronchial Vessel 1"
875,875,875,875,Lung,2,0.75,"PPP1R14A,CCN5,MYH11,BGN,LMOD1,COX4I2,GJA4",vascular associated smooth muscle cell,vascular associated smooth muscle cell,CL:0000359,muscle cell,Vascular Smooth Muscle,"Artery, Bronchial Vessel 2, Airway Smooth Muscle, Vascular Smooth Muscle, Pericyte, B, Platelet/Megakaryocyte, Plasmacytoid Dendritic, Myeloid Dendritic Type 1, Myeloid Dendritic Type 2, Vein, Fibromyocyte",Airway Smooth Muscle,"Myofibroblast, Fibromyocyte, Airway Smooth Muscle, Vascular Smooth Muscle"
876,876,876,876,Lung,2,0.75,"SYT4,LRRC38,MKRN9P,RSPO1,PLPPR4,FABP7,LINC01902",myofibroblast cell,myofibroblast cell,CL:0000186,myofibroblast cell,Neuroendocrine,Neuroendocrine,Neuroendocrine,"Neuroendocrine, Plasmacytoid Dendritic"
877,877,877,877,Lung,2,0.75,"RGN,INMT,PDGFRB,HIGD1B,KCNK3,PPP1R14A,BGN",pericyte cell,pericyte,CL:0000669,pericyte,Pericyte,"Neuroendocrine, Pericyte, Alveolar Fibroblast, Artery, Bronchial Vessel 2, Airway Smooth Muscle, Vascular Smooth Muscle, B, Platelet/Megakaryocyte, Plasmacytoid Dendritic, Myeloid Dendritic Type 1, Myeloid Dendritic Type 2, Vascular Smooth Muscle, Myofibroblast, Pericyte",Pericyte,"Alveolar Fibroblast, Adventitial Fibroblast, Mesothelial"
878,878,878,878,Lung,2,0.75,"ROR2,BNC1,PRG4,ITLN1,HAS1,VIPR2,CPB1",mesothelial cell,mesothelial cell,CL:0000077,epithelial cell,Mesothelial,"Mesothelial, Alveolar Fibroblast, Adventitial Fibroblast, Lipofibroblast, Mesothelial",Mesothelial,"Alveolar Fibroblast, Alveolar Epithelial Type 1, Club"
879,879,879,879,Lung,2,0.75,"TARID,ABCA6,SCN7A,AC009269.2,CARMN,AL135910.1,BMP5",fibroblast,fibroblast,CL:0000057,fibroblast,Alveolar Fibroblast,"Adventitial Fibroblast, Alveolar Fibroblast, Neuroendocrine",Adventitial Fibroblast,"Alveolar Fibroblast, Pericyte, Plasmacytoid Dendritic"
880,880,880,880,Lung,2,0.75,"FGL2,RNASE2,VCAN,CD300E,LILRA1,MPEG1,LILRB2",intermediate monocyte,intermediate monocyte,CL:0002393,macrophage/monocyte,"Classical Monocyte, OLR1+ Classical Monocyte, Intermediate Monocyte","Classical Monocyte, Nonclassical Monocyte, Intermediate Monocyte, OLR1+ Classical Monocyte",Classical Monocyte,Classical Monocyte
881,881,881,881,Lung,2,0.75,"PROX1,CEL,TMPRSS11E,ATP6V1G3,ASCL3,HEPACAM2,LINC01187",pulmonary ionocyte,pulmonary ionocyte,CL:0017000,epithelial cell,Ionocyte,Ionocyte,Ionocyte,Ionocyte
882,882,882,882,Lung,2,1.0,"EMP2,ARHGEF26,RTKN2,LMO7,SCEL,AGER,GPRC5A,DST,SPOCK2,LAMA3",Alveolar Epithelial Type 1,type I pneumocyte,CL:0002062,epithelial cell,Alveolar Epithelial Type 1,"Alveolar Epithelial Type 1, Capillary Aerocyte, Capillary Intermediate 1, Alveolar Fibroblast, Platelet/Megakaryocyte",Alveolar Epithelial Type 1,Alveolar Epithelial Type 1
883,883,883,883,Lung,2,1.0,"MS4A1,CD22,LINC00926,CD79B,SP140,BLK,VPREB3,CD79A,BANK1,ADAM28",B,B cell,CL:0000236,b cell,B,B,B,B
884,884,884,884,Lung,2,1.0,"FHL2,ITGA2,S100A2,KRT5,KRT15,KRT17,PERP,DST,KRT19,CLDN1",Basal,basal cell,CL:0000646,stem cell,"Basal, Proximal Basal, Proliferating Basal","Basal, Proximal Basal, Proliferating Basal, Vascular Smooth Muscle, Platelet/Megakaryocyte",Basal,Basal
885,885,885,885,Lung,2,1.0,"S100A12,S100A8,METTL9,CD99,CD300E,VCAN,FCN1,S100A9,CSF3R,CTSS",CD14+ Monocyte,CD14-positive monocyte,CL:0001054,macrophage/monocyte,"Classical Monocyte, Intermediate Monocyte, OLR1+ Classical Monocyte","Classical Monocyte, OLR1+ Classical Monocyte, Intermediate Monocyte, Basal, Proliferating Basal",OLR1+ Classical Monocyte,Classical Monocyte
886,886,886,886,Lung,2,1.0,"LEF1,MALAT1,CAMK4,CD6,IL7R,BCL11B,CD2,MAL,ITK,TRAT1",CD4 T,"CD4-positive, alpha-beta T cell",CL:0000624,t/nk cell,"Capillary, Capillary Intermediate 1, Capillary Intermediate 2, CD4+ Memory/Effector T, CD4+ Naive T, CD8+ Memory/Effector T, CD8+ Naive T","CD4+ Memory/Effector T, CD8+ Memory/Effector T, CD8+ Naive T, Natural Killer T, CD4+ Naive T",CD4+ Naive T,CD8+ Naive T
887,887,887,887,Lung,2,1.0,"FAM92B,ZMYND10,RSPH1,CAPS,CDHR3,C20orf85,DNAH6,SNTN,FANK1,CCDC170",Ciliated,ciliated cell,CL:0000064,ciliated cell,"Ciliated, Proximal Ciliated","Ciliated, Proximal Ciliated",Ciliated,Ciliated
888,888,888,888,Lung,2,1.0,"HLA-DQA1,CLEC10A,GPR183,HLA-DPB1,FCGR2B,CSF2RA,HLA-DMB,FPR3,MS4A6A,RGS1",Dendritic,dendritic cell,CL:0000451,dendritic cell,"Myeloid Dendritic Type 1, Myeloid Dendritic Type 2, IGSF21+ Dendritic, EREG+ Dendritic, TREM2+ Dendritic, OLR1+ Classical Monocyte","Myeloid Dendritic Type 1, Myeloid Dendritic Type 2, IGSF21+ Dendritic, EREG+ Dendritic, TREM2+ Dendritic, Classical Monocyte, OLR1+ Classical Monocyte, Nonclassical Monocyte, Intermediate Monocyte",Myeloid Dendritic Type 2,Dendritic
889,889,889,889,Lung,2,1.0,"DCN,SLIT2,CFD,LUM,FBLN1,C1S,ABLIM1,C1R,C3,ADH1B",Fibroblast,fibroblast,CL:0000057,fibroblast,"Adventitial Fibroblast, Alveolar Fibroblast","Adventitial Fibroblast, Alveolar Fibroblast, Macrophage, Proliferating Macrophage, Classical Monocyte, OLR1+ Classical Monocyte, Nonclassical Monocyte, Intermediate Monocyte",Adventitial Fibroblast,Adventitial Fibroblast
890,890,890,890,Lung,2,1.0,"PROX1,TIMP3,PPFIBP1,TBX1,TFF3,TFPI,PKHD1L1,CCL21,MMRN1,IGFBP7",Lymphatic,,,immune cell,"Lymphatic, Alveolar Fibroblast","Lymphatic, Alveolar Epithelial Type 1, Alveolar Fibroblast, Proximal Ciliated, Goblet",Lymphatic,"Proliferating Basal, Lymphatic, Proximal Basal"
891,891,891,891,Lung,2,1.0,"ACP5,VSIG4,GPD1,C1QB,APOC1,ITGAX,SLCO2B1,MARCO,C1QA,OLR1",Macrophage,macrophage,CL:0000235,macrophage/monocyte,"Macrophage, Proliferating Macrophage, TREM2+ Dendritic","Macrophage, Proliferating Macrophage, Signaling Alveolar Epithelial Type 2, TREM2+ Dendritic, IGSF21+ Dendritic",Macrophage,"Macrophage, Proliferating Macrophage, Dendritic"
892,892,892,892,Lung,2,1.0,"SPON2,PRF1,GZMB,NKG7,FCGR3A,KLRD1,KLRF1,CD247,PYHIN1,GNLY",Natural Killer,natural killer cell,CL:0000623,t/nk cell,"Natural Killer, CD8+ Naive T","Natural Killer, Proliferating NK/T, CD8+ Naive T, CD8+ Memory/Effector T, Natural Killer T",Natural Killer T,"Natural Killer, Proliferating NK/T, CD8+ Memory/Effector T"
893,893,893,893,Lung,2,1.0,"XBP1,HSP90B1,DERL3,MANF,PRDX4,TNFRSF17,MZB1,SSR4,SEC11C,POU2AF1",Plasma,plasma cell,CL:0000786,b cell,Plasma,"Goblet, Plasma, Proximal Ciliated, Natural Killer, Alveolar Epithelial Type 2",Plasmacytoid Dendritic,"Plasmacytoid Dendritic, Goblet, Ciliated"
894,894,894,894,Lung,2,1.0,"SFTPD,NAPSA,LPCAT1,LAMP3,SFTPB,SFTPA1,SLC34A2,ABCA3,SFTPA2,SFTPC",Alveolar Epithelial Type 2,type II pneumocyte,CL:0002063,epithelial cell,"Alveolar Epithelial Type 2, Signaling Alveolar Epithelial Type 2","Alveolar Epithelial Type 2, Signaling Alveolar Epithelial Type 2, Natural Killer, Proliferating NK/T",Alveolar Epithelial Type 2,"Alveolar Epithelial Type 2, Signaling Alveolar Epithelial Type 2"
895,895,895,895,Lung,2,1.0,"VWA5A,TPSAB1,CPA3,KIT,GATA2,CD44,GRAP2,MS4A2,HDC,HPGDS",Basophil/Mast,"basophil,mast cell","CL:0000767,CL:0000097",granulocyte,"Basophil/Mast 1, Basophil/Mast 2","Basophil/Mast 1, Basophil/Mast 2, Capillary, Alveolar Fibroblast, Proximal Ciliated",Basophil/Mast,"Basophil/Mast, Goblet, Mucous"
896,896,896,896,Lung,2,1.0,"FCGR3A,LILRB2,IFITM2,AIF1,SAT1,LST1,FCN1,RHOC,COTL1,RPS19",CD16+ Monocyte,,,macrophage/monocyte,"Macrophage, Nonclassical Monocyte","Macrophage, Nonclassical Monocyte, Intermediate Monocyte, Classical Monocyte, OLR1+ Classical Monocyte",Nonclassical Monocyte,"Macrophage, Classical Monocyte, Nonclassical Monocyte"
897,897,897,897,Lung,2,1.0,"CDC42EP1,EPAS1,CDH5,PODXL,RAMP3,CD81,FCN3,NOSTRIN,BTNL9,FLNB",Capillary,,,blood vessel cell,"Capillary, Vascular Smooth Muscle","Alveolar Epithelial Type 2, Basal, Proximal Basal, Capillary, Capillary Intermediate 1",Capillary,"Capillary, Pericyte, Lymphatic"
898,898,898,898,Lung,2,1.0,"NKG7,CD3G,GZMH,CD8B,CD8A,GZMA,RPL34,CCL5,CD3D,RPS27",CD8 T,"CD8-positive, alpha-beta T cell",CL:0000625,t/nk cell,"CD8+ Memory/Effector T, CD8+ Naive T, Natural Killer T, Natural Killer","CD8+ Memory/Effector T, CD8+ Naive T, Natural Killer T, Natural Killer, CD8+ Memory/Effector T",CD8+ Naive T,"CD8+ Memory/Effector T, CD8+ Naive T, Natural Killer T"
899,899,899,899,Lung,2,1.0,"KIAA1324,DSTN,WFDC2,CTSE,SFTPB,CEACAM6,C16orf89,PIGR,SCGB3A2,CYB5A",Club,club cell,CL:0000158,epithelial cell,"Alveolar Epithelial Type 2, Signaling Alveolar Epithelial Type 2, Club","Club, Ciliated, Proximal Ciliated, Differentiating Basal, Alveolar Epithelial Type 2",Goblet,"Goblet, Club, Differentiating Basal"
900,900,900,900,Lung,2,1.0,"BGN,COL1A2,COL1A1,LTBP1,POSTN,COL3A1,COL6A3,ITGBL1,ASPN,CALD1",Myofibroblast,myofibroblast cell,CL:0000186,myofibroblast cell,"Myofibroblast, Fibromyocyte","Myofibroblast, Adventitial Fibroblast, Lipofibroblast, Fibromyocyte",Myofibroblast,"Pericyte, Myofibroblast, Vascular Smooth Muscle, Adventitial Fibroblast"
901,901,901,901,Lung,2,1.0,"IRF4,NPC2,IRF7,GZMB,SEC61B,IL3RA,TYROBP,PPP1R14B,PLD4,PTPRE",Plasmacytoid Dendritic,plasmacytoid dendritic cell,CL:0000784,dendritic cell,"Plasmacytoid Dendritic, Proliferating Macrophage, Myeloid Dendritic Type 1, OLR1+ Classical Monocyte","Plasmacytoid Dendritic, Myeloid Dendritic Type 2, Classical Monocyte, Nonclassical Monocyte",Plasmacytoid Dendritic,"Plasmacytoid Dendritic, Alveolar Epithelial Type 2, Lymphatic, Proliferating Macrophage"
902,902,902,902,Lung,2,1.0,"STMN1,ANLN,TPX2,BIRC5,CDK1,KPNA2,UBE2C,H2AFZ,TYMS,NUSAP1",Proliferating Macrophage,,,macrophage/monocyte,"Proliferating Basal, Proliferating NK/T, Proliferating Macrophage","Proliferating Basal, Proliferating NK/T, Proliferating Macrophage",Proliferating Macrophage,"Proliferating Basal, Proliferating NK/T, Proliferating Macrophage"
903,903,903,903,Lung,2,1.0,"KIF2C,SMC4,UBE2C,CENPF,TOP2A,BIRC5,AURKB,NUSAP1,H2AFV,HMGB2",Proliferating NK/T,,,t/nk cell,"Proliferating Basal, Proliferating NK/T, Proliferating Macrophage","Proliferating Basal, Proliferating NK/T, Proliferating Macrophage",Proliferating NK/T,"Proliferating Basal, Proliferating NK/T, Proliferating Macrophage"
904,904,904,904,Lung,2,1.0,"PLVAP,INHBB,VWF,SPARCL1,COL15A1,EMCN,ZNF385D,SPRY1,ENPP2,POSTN",Bronchial Vessel,,,bronchial cell,"Bronchial Vessel 1, Bronchial Vessel 2","Bronchial Vessel 1, Bronchial Vessel 2",Bronchial Vessel 1,"Artery, Vein, Capillary, Endothelial"
905,905,905,905,Lung,2,1.0,"BPIFB1,SCGB1A1,SCGB3A1,SLPI,MUC5B,MSMB,WFDC2,LCN2,RARRES1,SAA1",Mucous,,,mucosal cell,"Goblet, Mucous, Serous","Mucous, Goblet",Mucous,"Goblet, Mucous, Natural Killer, Proliferating NK/T"
906,906,906,906,Lung,2,1.0,"PRSS23,SLCO2A1,SRPX,PTPRB,LIFR,TGM2,SELP,VWF,CPE,PLA1A",Vein,,,blood vessel cell,"Vein, Proximal Basal, Differentiating Basal, Proliferating Basal, Artery, Capillary, Vein","Vein, Vascular Smooth Muscle, Artery",Vein,"Proliferating Basal, Vascular Smooth Muscle, Myofibroblast, Alveolar Epithelial Type 1"
907,907,907,907,Lung,2,1.0,"LAMB1,LAMC3,COL4A1,COL4A2,CALD1,PDGFRB,COX4I2,TACC1,NID1,CHN1",Pericyte,pericyte,CL:0000669,pericyte,Pericyte,"Pericyte, Alveolar Epithelial Type 1, Capillary",Pericyte,"Lipofibroblast, Pericyte, Adventitial Fibroblast, Alveolar Epithelial Type 1"
908,908,908,908,Lung,2,1.0,"PLN,ACTA2,DSTN,MYH11,TPM2,CALD1,CSRP1,DES,CNN1,MYL9",Smooth Muscle,smooth muscle cell,CL:0000192,muscle cell,"Airway Smooth Muscle, Vascular Smooth Muscle","Airway Smooth Muscle, Vascular Smooth Muscle, Fibromyocyte",Airway Smooth Muscle,"Airway Smooth Muscle, Fibromyocyte, Vascular Smooth Muscle"
909,909,909,909,Lung,2,1.0,"SEMA3G,PTPRB,DKK2,EFNB2,BMX,ARGLU1,GJA5,FBLN5,HEY1,EPAS1",Artery,,,blood vessel cell,Artery,"Artery, Vein, Capillary",Artery,"Artery, Capillary, Endothelial"
910,910,910,910,Lung,2,1.0,"EMCN,TBX2,SOSTDC1,ESAM,CYP3A5,STXBP6,CLDN5,HPGD,APP,EDNRB",Capillary Aerocyte,,,epithelial cell,Capillary Aerocyte,"Capillary Aerocyte, Capillary Intermediate 1",Capillary Aerocyte,Capillary Aerocyte
911,911,911,911,Lung,2,1.0,"PECAM1,GALNT18,VAT1,SH3BP5,IPO7,WWTR1,EPAS1,SRSF11,RALA,ACVRL1",Capillary Intermediate,,,blood vessel cell,Capillary Aerocyte,"Capillary Aerocyte, Capillary Intermediate 1, Classical Monocyte",Capillary Aerocyte,Capillary Aerocyte
912,912,912,912,Lung,2,1.0,"FGF7,STEAP1,WT1,C7,C3,HAS1,OSR1,MEDAG,CPXM1,CCDC71L",Lipofibroblast,alveolar type 1 fibroblast cell,CL:4028004,fibroblast,Lipofibroblast,"Adventitial Fibroblast, Lipofibroblast, Mesothelial",Adventitial Fibroblast,Adventitial Fibroblast
913,913,913,913,Lung,2,1.0,"DMKN,C3,DSC3,WT1,ALDH1A3,MGARP,ITLN1,GALNT9,PRG4,SLPI",Mesothelial,mesothelial cell,CL:0000077,epithelial cell,Mesothelial,"Ciliated, Proximal Ciliated, Proximal Basal, Basal, Mesothelial, Lipofibroblast",Mesothelial,Ciliated
914,914,914,914,Lung,2,1.0,"CMTM5,ACRBP,ITGA2B,TUBB1,PF4,GRAP2,TMEM40,CABP5,GP6,GP9",Platelet/Megakaryocyte,"platelet,megakaryocyte","CL:0000233,CL:0000556","platelet,megakaryocyte",Platelet/Megakaryocyte,Platelet/Megakaryocyte,Platelet/Megakaryocyte,Platelet/Megakaryocyte
915,915,915,915,Lung,2,1.0,"S100A6,CD2,CTSW,GNLY,CEBPB,CXCR4,LGALS1,CD7,ZFP36L2,CCL5",Natural Killer T,,,t/nk cell,Natural Killer,"Alveolar Epithelial Type 1, Capillary Aerocyte, CD4+ Memory/Effector T, CD8+ Memory/Effector T, CD8+ Naive T, Natural Killer T, Natural Killer, Classic Monocyte",Natural Killer,Macrophage
916,916,916,916,Lung,2,1.0,"CNN1,CLU,CST5,MET,RAMP1,FAM150A,HSPB3,IGF1,SCX,CSRP1",Fibromyocyte,,,muscle cell,Vascular Smooth Muscle,"Airway Smooth Muscle, Vascular Smooth Muscle, Fibromyocyte, Vein, Bronchial Vessel 1, Lymphatic, Myofibroblast, Basophil/Mast 1",Fibromyocyte,Fibromyocyte
917,917,917,917,Lung,2,1.0,"GABRP,S100P,CLIC1,WFDC2,AGR2,COX5A,FAM3D,CXCL17,PSCA,TXN",Goblet,goblet cell,CL:0000160,epithelial cell,Goblet,"Goblet, Proximal Ciliated, Ciliated, Differentiating Basal",Goblet,Goblet
918,918,918,918,Lung,2,1.0,"TFF3,TMPRSS11E,PHGR1,STAC2,HEPACAM2,ATP6V1B1,FOXI1,BSND,ASCL3,MFSD6L",Ionocyte,ionocyte,CL:0005006,epithelial cell,Ionocyte,"Proximal Ciliated, Goblet, Mucous, Ionocyte, Lymphatic",Ionocyte,Ionocyte
919,919,919,919,Lung,2,1.0,"CPE,SEC11C,PCSK1N,SCGN,NENF,FAM46A,CHGA,EGR1,PRDX2,BEX1",Neuroendocrine,neuroendocrine cell,CL:0000165,epithelial cell,Neuroendocrine,"Neuroendocrine, Ionocyte, Vein, Airway Smooth Muscle, Vascular Smooth Muscle, Adventitial Fibroblast, Macrophage, Proliferating Macrophage",Neuroendocrine,Neuroendocrine
920,920,920,920,Lung,2,1.0,"TESC,LYZ,PRH2,PRB4,ZG16B,PHB,LPO,TCN1,PRR4,PRB3",Serous,serous secreting cell,CL:0000313,secretory cell,"Serous, Mucous","Serous, Macrophage, CD4+ Memory/Effector T","Serous,Mucous,Goblet",Serous
