1745,1745,1745,1745,Lung,4,0.5,"PRR4,PRB3,C6orf58,TCN1,LPO",serous cell of epithelium of bronchus,serous cell of epithelium of bronchus,CL:1000331,secretory cell,Serous,"Serous, Serous, Serous, Serous, Serous",Serous,Serous
1746,1746,1746,1746,Lung,4,0.5,"HCLS1,FCGR3A,CD163,MAFB,AIF1",non-classical monocyte,non-classical monocyte,CL:0000875,macrophage/monocyte,"Macrophage, Classical Monocyte, Nonclassical Monocyte, Intermediate Monocyte","IGSF21+ Dendritic, EREG+ Dendritic, OLR1+ Classical Monocyte, Nonclassical Monocyte, Intermediate Monocyte, Natural Killer, Proliferating NK/T, Macrophage, Proliferating Macrophage, Nonclassical Monocyte, Intermediate Monocyte, Macrophage, Proliferating Macrophage, IGSF21+ Dendritic, EREG+ Dendritic, Classical Monocyte, OLR1+ Classical Monocyte, Intermediate Monocyte, Signaling Alveolar Epithelial Type 2, Adventitial Fibroblast, Alveolar Fibroblast, IGSF21+ Dendritic, EREG+ Dendritic, TREM2+ Dendritic, Classical Monocyte, OLR1+ Classical Monocyte, Nonclassical Monocyte, Intermediate Monocyte, Macrophage, Myeloid Dendritic Type 2, IGSF21+ Dendritic, EREG+ Dendritic, TREM2+ Dendritic, Classical Monocyte, OLR1+ Classical Monocyte, Nonclassical Monocyte, Intermediate Monocyte",Nonclassical Monocyte,"Macrophage, Dendritic"
1747,1747,1747,1747,Lung,4,0.5,"RAMP2,CALCRL,FCN3,VWF,LRRC32",capillary endothelial cell,capillary endothelial cell,CL:0002144,endothelial cell,"Capillary, Vein","Ionocyte, Capillary Aerocyte, Capillary, Mesothelial, Plasma, Ionocyte, Artery, Vein, Capillary, Vascular Smooth Muscle, Vein, Capillary, Vein, Capillary Intermediate 1, Bronchial Vessel 2, Airway Smooth Muscle, Vascular Smooth Muscle",Capillary,Capillary
1748,1748,1748,1748,Lung,4,0.5,"CA4,GNG11,TIMP3,IL1RL1,HPGD",capillary aerocyte,,,epithelial cell,Capillary Aerocyte,"Capillary Aerocyte, Capillary, Capillary Intermediate 1, Capillary Aerocyte, Lymphatic, Pericyte, Mesothelial, Platelet/Megakaryocyte, Alveolar Epithelial Type 1, Vein, Capillary, Capillary Intermediate 1, Alveolar Fibroblast, Basophil/Mast 1, Basophil/Mast 2, Capillary Aerocyte, Capillary Intermediate 1, Basophil/Mast 1, Basophil/Mast 2, Differentiating Basal, Signaling Alveolar Epithelial Type 2, Capillary Aerocyte, Capillary Intermediate 1, Capillary Intermediate 2, Pericyte, Basophil/Mast 1, Basophil/Mast 2",Capillary Aerocyte,"Capillary, Pericyte"
1749,1749,1749,1749,Lung,4,0.5,"ITLN2,MS4A15,ST6GALNAC5,PKDCC,RTKN2",type i pneumocyte,type I pneumocyte,CL:0002062,epithelial cell,Alveolar Epithelial Type 1,"Alveolar Epithelial Type 1, Club, Alveolar Epithelial Type 1, Serous, Alveolar Epithelial Type 1",Alveolar Epithelial Type 1,Alveolar Epithelial Type 1
1750,1750,1750,1750,Lung,4,0.5,"C7,CLU,VWF,IGFBP7,RAMP3",vein endothelial cell,vein endothelial cell,CL:0002543,endothelial cell,"Vein, Adventitial Fibroblast, Lymphatic, Capillary","Vein, Alveolar Fibroblast, Lymphatic, Natural Killer",Vein,"Adventitial Fibroblast, Basal, Lymphatic, Vein"
1751,1751,1751,1751,Lung,4,0.5,"LUM,FBLN1,C7,C1S,MGP",alveolar fibroblast,,,fibroblast,"Adventitial Fibroblast, Alveolar Fibroblast","Adventitial Fibroblast, Basal, Vein, Myofibroblast","Adventitial Fibroblast,Alveolar Fibroblast,Vein","Alveolar Fibroblast, Basal, Vein"
1752,1752,1752,1752,Lung,4,0.5,"RELN,PROX1,FOXC2,SCN3B,CCL21",endothelial cell of lymphatic vessel,endothelial cell of lymphatic vessel,CL:0002138,endothelial cell,Lymphatic,"Lymphatic, Ionocyte, Lymphatic",Lymphatic,"Lymphatic, Neuroendocrine"
1753,1753,1753,1753,Lung,4,0.5,"MYH11,CARMN,PLAC9,ACTG2,CNN1",bronchial smooth muscle cell,bronchial smooth muscle cell,CL:0002598,muscle cell,"Airway Smooth Muscle, Vascular Smooth Muscle, Fibromyocyte","Airway Smooth Muscle, Airway Smooth Muscle, Artery, Airway Smooth Muscle","Airway Smooth Muscle,Vascular Smooth Muscle","Airway Smooth Muscle, Vascular Smooth Muscle"
1754,1754,1754,1754,Lung,4,0.5,"CLEC4C,LILRA4,SPIB,LAMP5,PLD4",plasmacytoid dendritic cell,plasmacytoid dendritic cell,CL:0000784,dendritic cell,Plasmacytoid Dendritic,"Plasmacytoid Dendritic, Plasmacytoid Dendritic, B, Myofibroblast, Plasmacytoid Dendritic",Plasmacytoid Dendritic,"Plasmacytoid Dendritic, Myofibroblast"
1755,1755,1755,1755,Lung,4,0.5,"SFTPB,ELF3,PIGR,SCGB3A2,CYP2B7P",club cell,club cell,CL:0000158,epithelial cell,"Club, Signaling Alveolar Epithelial Type 2, Platelet/Megakaryocyte","Club, Platelet/Megakaryocyte, Club, Club, Club","Club,Signaling Alveolar Epithelial Type 2","Signaling Alveolar Epithelial Type 2, Goblet, Club"
1756,1756,1756,1756,Lung,4,0.5,"LIFR,ACKR1,PLVAP,SPARCL1,VWF",lung microvascular endothelial cell,lung microvascular endothelial cell,CL:2000016,endothelial cell,"Vein, Capillary, Bronchial Vessel","Artery, Vein, Bronchial Vessel 1, Bronchial Vessel 1, Vein","Bronchial Vessel 1,Vein","Pericyte, Vascular Smooth Muscle"
1757,1757,1757,1757,Lung,4,0.5,"BGN,CCN5,C2orf40,MYH11,PDGFRB",vascular associated smooth muscle cell,vascular associated smooth muscle cell,CL:0000359,muscle cell,"Vascular Smooth Muscle, Pericyte","Myofibroblast, Vascular Smooth Muscle, Ciliated, Airway Smooth Muscle, Pericyte","Pericyte,Vascular Smooth Muscle",Alveolar Fibroblast
1758,1758,1758,1758,Lung,4,0.5,"FABP7,LRRC38,RSPO1,PLPPR4,MKRN9P",myofibroblast cell,myofibroblast cell,CL:0000186,myofibroblast cell,Alveolar Fibroblast,Alveolar Fibroblast,Alveolar Fibroblast,"Pericyte, Neuroendocrine"
1759,1759,1759,1759,Lung,4,0.5,"PPP1R14A,HIGD1B,NDUFA4L2,PDGFRB,KCNK3",pericyte cell,pericyte,CL:0000669,pericyte,"Pericyte, Airway Smooth Muscle, Vascular Smooth Muscle, Platelet/Megakaryocyte","Artery, Pericyte, Basal, Pericyte, Pericyte",Pericyte,"Plasmacytoid Dendritic, Myeloid Dendritic Type 2"
1760,1760,1760,1760,Lung,4,0.5,"CPB1,ROR2,BNC1,RSPO1,PRG4",mesothelial cell,mesothelial cell,CL:0000077,epithelial cell,"Alveolar Fibroblast, Mesothelial","Mesothelial, Alveolar Fibroblast",Mesothelial and Alveolar Fibroblast,"Alveolar Fibroblast, Mesothelial"
1761,1761,1761,1761,Lung,4,0.5,"SGIP1,AL135910.1,SCN7A,CACNA1C,CARMN",fibroblast,fibroblast,CL:0000057,fibroblast,"Pericyte, Adventitial Fibroblast","Pericyte, Alveolar Fibroblast",Pericyte and Adventitial Fibroblast,Pericyte
1762,1762,1762,1762,Lung,4,0.5,"FGL2,CORO1A,RNASE2,LILRB2,VCAN",intermediate monocyte,intermediate monocyte,CL:0002393,macrophage/monocyte,"Classical Monocyte, OLR1+ Classical Monocyte, Intermediate Monocyte, EREG+ Dendritic","Vein, Lymphatic, Adventitial Fibroblast, Myeloid Dendritic Type 1, Myeloid Dendritic Type 2, IGSF21+ Dendritic, EREG+ Dendritic, Classical Monocyte, Nonclassical Monocyte, Intermediate Monocyte, B, Classical Monocyte, OLR1+ Classical Monocyte, Nonclassical Monocyte, Intermediate Monocyte, EREG+ Dendritic, Classical Monocyte, OLR1+ Classical Monocyte, Intermediate Monocyte","Classical, Nonclassical, Intermediate)","Myeloid Dendritic Type 1, Classical Monocyte, Nonclassical Monocyte, Intermediate Monocyte"
1763,1763,1763,1763,Lung,4,0.5,"PROX1,CEL,LINC01187,ATP6V1G3,ASCL3",pulmonary ionocyte,pulmonary ionocyte,CL:0017000,epithelial cell,Ionocyte,"Ionocyte, Neuroendocrine, Lymphatic, Ionocyte",Ionocyte,Ionocyte
1764,1764,1764,1764,Lung,4,0.75,"SCEL,DST,SPOCK2,LAMA3,RTKN2,GPRC5A,AGER",Alveolar Epithelial Type 1,type I pneumocyte,CL:0002062,epithelial cell,"Alveolar Epithelial Type 1, Capillary Aerocyte","Alveolar Epithelial Type 1, Basal, Ionocyte, Neuroendocrine, Alveolar Epithelial Type 1, Capillary Aerocyte, Capillary Intermediate 1, Alveolar Fibroblast, Macrophage, Proliferating Macrophage, IGSF21+ Dendritic, TREM2+ Dendritic, Alveolar Epithelial Type 1, Alveolar Epithelial Type 1",Alveolar Epithelial Type 1,Alveolar Epithelial Type 1
1765,1765,1765,1765,Lung,4,0.75,"LINC00926,BLK,CD79B,MS4A1,SP140,VPREB3,CD22",B,B cell,CL:0000236,b cell,B,"B, B, B, B, B",B,"B, Classical Monocyte"
1766,1766,1766,1766,Lung,4,0.75,"KRT15,DST,KRT17,ITGA2,FHL2,KRT5,S100A2",Basal,basal cell,CL:0000646,stem cell,"Basal, Proximal Basal, Proliferating Basal","Basal, Proximal Basal, Proliferating Basal, Basal, Proximal Basal, Alveolar Epithelial Type 1, Capillary, Alveolar Fibroblast, Basal, Proximal Basal, Proliferating Basal, Ionocyte, Lymphatic, Vascular Smooth Muscle, Myofibroblast, Platelet/Megakaryocyte",Basal,"Basal, Proliferating Basal"
1767,1767,1767,1767,Lung,4,0.75,"METTL9,S100A8,CD300E,S100A12,FCN1,CSF3R,CTSS",CD14+ Monocyte,CD14-positive monocyte,CL:0001054,macrophage/monocyte,"Classical Monocyte, OLR1+ Classical Monocyte, Nonclassical Monocyte","Basal, Proliferating Basal, Goblet, Ionocyte, Neuroendocrine, Proliferating NK/T, Classical Monocyte, OLR1+ Classical Monocyte, Basal, Classical Monocyte, OLR1+ Classical Monocyte, Intermediate Monocyte, EREG+ Dendritic, Classical Monocyte, OLR1+ Classical Monocyte, Nonclassical Monocyte, Intermediate Monocyte, Classical Monocyte, OLR1+ Classical Monocyte, Nonclassical Monocyte, Intermediate Monocyte",Classical Monocyte and OLR1+ Classical Monocyte,"Classical Monocyte, CD8+ Naive T, CD4+ Memory/Effector T"
1768,1768,1768,1768,Lung,4,0.75,"TRAT1,LEF1,IL7R,ITK,CD6,CAMK4,MAL",CD4 T,"CD4-positive, alpha-beta T cell",CL:0000624,t/nk cell,"CD4+ Naive T, CD4+ Memory/Effector T, CD8+ Naive T, CD8+ Memory/Effector T","CD8+ Memory/Effector T, CD4+ Memory/Effector T, CD4+ Naive T, Capillary, Capillary Intermediate 1, Capillary Intermediate 2, CD8+ Memory/Effector T, CD8+ Naive T, CD4+ Memory/Effector T, CD4+ Naive T, Natural Killer T, Myeloid Dendritic Type 1, CD8+ Naive T, CD4+ Memory/Effector T, CD4+ Naive T, CD8+ Memory/Effector T, CD8+ Naive T, CD4+ Memory/Effector T, CD4+ Naive T, Proliferating NK/T","T cells (include CD4+, CD8+, Naive, Memory/Effector)","Ciliated, Proximal Ciliated"
1769,1769,1769,1769,Lung,4,0.75,"CCDC170,DNAH6,RSPH1,SNTN,CAPS,ZMYND10,FANK1",Ciliated,ciliated cell,CL:0000064,ciliated cell,"Ciliated, Proximal Ciliated, Platelet/Megakaryocyte","Ciliated, Proximal Ciliated, Platelet/Megakaryocyte, IGSF21+ Dendritic, Ciliated, Proximal Ciliated, Ciliated, Proximal Ciliated, Platelet/Megakaryocyte, Ciliated, Proximal Ciliated, Platelet/Megakaryocyte, Platelet/Megakaryocyte",Ciliated,"Ciliated, Basal"
1770,1770,1770,1770,Lung,4,0.75,"CLEC10A,MS4A6A,RGS1,FPR3,CSF2RA,HLA-DPB1,HLA-DMB",Dendritic,dendritic cell,CL:0000451,dendritic cell,"Dendritic cells, Myeloid dendritic types","Myeloid Dendritic Type 1, Myeloid Dendritic Type 2, IGSF21+ Dendritic, EREG+ Dendritic, Classical Monocyte, Nonclassical Monocyte, Intermediate Monocyte, CD4+ Memory/Effector T, Basophil/Mast 1, Basophil/Mast 2",Myeloid Dendritic,"Classical Monocyte, Myeloid Dendritic Type 1, Myeloid Dendritic Type 2, EREG+ Dendritic"
1771,1771,1771,1771,Lung,4,0.75,"LUM,ABLIM1,C1S,FBLN1,ADH1B,CFD,C3",Fibroblast,fibroblast,CL:0000057,fibroblast,"Adventitial Fibroblast, Alveolar Fibroblast","Adventitial Fibroblast, Alveolar Fibroblast, Basal",Adventitial Fibroblast,"Alveolar Fibroblast, Adventitial Fibroblast, Lipofibroblast, Basal"
1772,1772,1772,1772,Lung,4,0.75,"TBX1,PKHD1L1,TIMP3,PROX1,MMRN1,PPFIBP1,TFF3",Lymphatic,,,immune cell,Lymphatic,"Lymphatic, Vein, Capillary, Capillary Intermediate 1, Alveolar Fibroblast",Lymphatic,"Tissue macrophage, Lymphatic"
1773,1773,1773,1773,Lung,4,0.75,"SLCO2B1,GPD1,APOC1,ITGAX,C1QA,VSIG4,ACP5",Macrophage,macrophage,CL:0000235,macrophage/monocyte,Macrophage,"Lymphatic, Macrophage, IGSF21+ Dendritic, EREG+ Dendritic, TREM2+ Dendritic, Signaling Alveolar Epithelial Type 2, Lipofibroblast, Mesothelial",Macrophage,"Macrophage, Signaling Alveolar Epithelial Type 2, Dendritic Cells"
1774,1774,1774,1774,Lung,4,0.75,"KLRD1,GZMB,CD247,KLRF1,GNLY,FCGR3A,PRF1",Natural Killer,natural killer cell,CL:0000623,t/nk cell,Natural Killer,"CD8+ Memory/Effector T, CD8+ Naive T, Natural Killer T, Natural Killer, Proliferating NK/T",Natural Killer,"CD8+ Memory/Effector T, Natural Killer T"
1775,1775,1775,1775,Lung,4,0.75,"DERL3,PRDX4,MANF,POU2AF1,TNFRSF17,SEC11C,XBP1",Plasma,plasma cell,CL:0000786,b cell,"Plasma, B","Ciliated, Proximal Ciliated, Plasma, Plasmacytoid Dendritic, B",Plasma,"Innate Immune Cells, Plasma Cells, Goblet Cells"
1776,1776,1776,1776,Lung,4,0.75,"SFTPB,NAPSA,SFTPA1,SLC34A2,LPCAT1,SFTPD,ABCA3",Alveolar Epithelial Type 2,type II pneumocyte,CL:0002063,epithelial cell,"Signaling Alveolar Epithelial Type 2, Alveolar Epithelial Type 2","Club, Alveolar Epithelial Type 2, Signaling Alveolar Epithelial Type 2, Natural Killer, Proliferating NK/T",Alveolar Epithelial Type 2,"Bronchial Vessel 1, Basophil/Mast, Natural Killer"
1777,1777,1777,1777,Lung,4,0.75,"GRAP2,HPGDS,TPSAB1,KIT,CPA3,HDC,GATA2",Basophil/Mast,"basophil,mast cell","CL:0000767,CL:0000097",granulocyte,Basophil/Mast,"CD4+ Memory/Effector T, Basophil/Mast 1, Basophil/Mast 2, Ionocyte, Basophil/Mast 1, Basophil/Mast 2",Basophil/Mast,"Proliferating Basal, Nonclassical Monocyte"
1778,1778,1778,1778,Lung,4,0.75,"RPS19,AIF1,IFITM2,FCN1,LILRB2,RHOC,COTL1",CD16+ Monocyte,,,macrophage/monocyte,"Macrophage, Nonclassical Monocyte","Club, Basal, Proximal Basal, Differentiating Basal, Proliferating Basal, Signaling Alveolar Epithelial Type 2, Bronchial Vessel 1, Lymphatic, Myofibroblast, Lipofibroblast, Mesothelial, B, CD8+ Memory/Effector T, CD4+ Naive T, Nonclassical Monocyte",Nonclassical Monocyte,"CD4+ Memory/Effector T, Plasma, Capillary Endothelial"
1779,1779,1779,1779,Lung,4,0.75,"CDC42EP1,FLNB,BTNL9,CD81,FCN3,PODXL,EPAS1",Capillary,,,blood vessel cell,"Signaling Alveolar Epithelial Type 2, Capillary","Alveolar Epithelial Type 2, Bronchial Vessel 2, Ciliated, Neuroendocrine, Alveolar Epithelial Type 1, Artery, Vein, Mesothelial, Plasmacytoid Dendritic, Nonclassical Monocyte, Intermediate Monocyte",Capillary,"Alveolar Epithelial Type 1, Alveolar Epithelial Type 2, Vein, Club Cells"
1780,1780,1780,1780,Lung,4,0.75,"RPS27,CD3D,GZMH,RPL34,CCL5,NKG7,CD3G",CD8 T,"CD8-positive, alpha-beta T cell",CL:0000625,t/nk cell,"CD8+ Naive T, Natural Killer","B, CD8+ Memory/Effector T, CD8+ Naive T, Natural Killer, CD4+ Naive T, Club, Basal","B,T,Natural Killer,Plasmacytoid Dendritic",CD4+ Memory/Effector T
1781,1781,1781,1781,Lung,4,0.75,"SFTPB,CYB5A,C16orf89,SCGB3A2,WFDC2,PIGR,CEACAM6",Club,club cell,CL:0000158,epithelial cell,Alveolar Epithelial Type 2,"Club, Signaling Alveolar Epithelial Type 2, Signaling Alveolar Epithelial Type 2, Mucous, Serous, Goblet","Club,Alveolar Epithelial Type 2,Signaling Alveolar Epithelial Type 2,Mucous",Signaling Alveolar Epithelial Type 2
1782,1782,1782,1782,Lung,4,0.75,"COL3A1,ITGBL1,COL1A2,LTBP1,COL6A3,ASPN,POSTN",Myofibroblast,myofibroblast cell,CL:0000186,myofibroblast cell,Myofibroblast,"Ionocyte, Myofibroblast, Adventitial Fibroblast, Artery, Myofibroblast, Alveolar Fibroblast","Myofibroblast,Adventitial Fibroblast,Lipofibroblast,Alveolar Fibroblast",Myofibroblast
1783,1783,1783,1783,Lung,4,0.75,"SEC61B,PTPRE,PPP1R14B,GZMB,IRF4,IRF7,TYROBP",Plasmacytoid Dendritic,plasmacytoid dendritic cell,CL:0000784,dendritic cell,Plasmacytoid Dendritic,"Serous, Plasmacytoid Dendritic, Proliferating Basal, CD8+ Naive T, Plasmacytoid Dendritic, Plasmacytoid Dendritic","Plasmacytoid Dendritic,Myeloid Dendritic,Classical Monocyte,Lymphatic,Natural Killer",Plasmacytoid Dendritic
1784,1784,1784,1784,Lung,4,0.75,"BIRC5,H2AFZ,CDK1,UBE2C,KPNA2,NUSAP1,TYMS",Proliferating Macrophage,,,macrophage/monocyte,Proliferating Macrophage,"Proliferating Basal, Proximal Basal, Proliferating Basal, Proliferating Basal, Proliferating Basal, Proliferating Basal","Proliferating Basal,Proliferating NK/T,Proliferating Macrophage",Proliferating Basal
1785,1785,1785,1785,Lung,4,0.75,"UBE2C,NUSAP1,AURKB,H2AFV,CENPF,HMGB2,BIRC5",Proliferating NK/T,,,t/nk cell,Proliferating Macrophage,"Proliferating Basal, Proliferating Basal, Proliferating Basal, Proximal Basal, Proliferating Basal, Proliferating Basal","Proliferating Basal,Proliferating NK/T,Proliferating Macrophage",Proliferating Basal
1786,1786,1786,1786,Lung,4,0.75,"ZNF385D,EMCN,COL15A1,ENPP2,PLVAP,VWF,POSTN",Bronchial Vessel,,,bronchial cell,Bronchial Vessel 1,"Bronchial Vessel 1, Capillary Aerocyte, Bronchial Vessel 1, Artery, Bronchial Vessel 1, Bronchial Vessel 1","Bronchial Vessel,Pericyte,Artery,Vein,Myofibroblast,Fibromyocyte",Bronchial Vessel 1
1787,1787,1787,1787,Lung,4,0.75,"SCGB1A1,WFDC2,LCN2,SLPI,RARRES1,MSMB,SAA1",Mucous,,,mucosal cell,Mucous,"Mucous, Differentiating Basal, Goblet, Mucous, Ciliated, Goblet","Mucous,Goblet,Adventitial Fibroblast,Myofibroblast",Goblet
1788,1788,1788,1788,Lung,4,0.75,"TGM2,PRSS23,PTPRB,LIFR,PLA1A,SELP,SLCO2A1",Vein,,,blood vessel cell,Artery,"Goblet, Proximal Basal, Artery, Signaling Alveolar Epithelial Type 2, Vein, Platelet/Megakaryocyte","Artery,Vein,Vascular Smooth Muscle",Proliferating NK/T
1789,1789,1789,1789,Lung,4,0.75,"LAMB1,TACC1,LAMC3,CHN1,COL4A2,PDGFRB,NID1",Pericyte,pericyte,CL:0000669,pericyte,Pericyte,"Ionocyte, Alveolar Epithelial Type 1, Pericyte, Pericyte, Alveolar Epithelial Type 1, Pericyte","Pericyte,Capillary,Alveolar Epithelial Type 1",Pericyte
1790,1790,1790,1790,Lung,4,0.75,"ACTA2,MYH11,PLN,CNN1,DSTN,DES,MYL9",Smooth Muscle,smooth muscle cell,CL:0000192,muscle cell,Vascular Smooth Muscle,"Fibromyocyte, Airway Smooth Muscle, Vascular Smooth Muscle",Airway Smooth Muscle,Vascular Smooth Muscle
1791,1791,1791,1791,Lung,4,0.75,"ARGLU1,GJA5,DKK2,EFNB2,HEY1,PTPRB,FBLN5",Artery,,,blood vessel cell,Artery,"Natural Killer, Alveolar Fibroblast, Artery, Mesothelial",Artery,Artery
1792,1792,1792,1792,Lung,4,0.75,"HPGD,SOSTDC1,APP,EMCN,CYP3A5,TBX2,STXBP6",Capillary Aerocyte,,,epithelial cell,Capillary Aerocyte,"Airway Smooth Muscle, Capillary Aerocyte, Capillary Intermediate 1, Natural Killer T, Adventitial Fibroblast",Capillary Aerocyte,Capillary
1793,1793,1793,1793,Lung,4,0.75,"GALNT18,WWTR1,ACVRL1,SRSF11,VAT1,RALA,IPO7",Capillary Intermediate,,,blood vessel cell,Fibromyocyte,"Capillary Aerocyte, Vein, Basophil/Mast 1, Myofibroblast",Alveolar Epithelial Type 1,Capillary
1794,1794,1794,1794,Lung,4,0.75,"WT1,STEAP1,HAS1,C7,FGF7,CCDC71L,OSR1",Lipofibroblast,alveolar type 1 fibroblast cell,CL:4028004,fibroblast,Mesothelial,"Mesothelial, Adventitial Fibroblast, Lipofibroblast, Vein",Mesothelial,Adventitial Fibroblast
1795,1795,1795,1795,Lung,4,0.75,"SLPI,ALDH1A3,DMKN,PRG4,DSC3,C3,GALNT9",Mesothelial,mesothelial cell,CL:0000077,epithelial cell,Mesothelial,"Goblet, Basal, Ciliated, Proximal Ciliated, Mesothelial",Goblet,Adventitial Fibroblast
1796,1796,1796,1796,Lung,4,0.75,"GRAP2,TUBB1,GP9,TMEM40,ACRBP,GP6,ITGA2B",Platelet/Megakaryocyte,"platelet,megakaryocyte","CL:0000233,CL:0000556","platelet,megakaryocyte",Platelet/Megakaryocyte,"CD4+ Memory/Effector T, Platelet/Megakaryocyte, Proximal Basal",Platelet/Megakaryocyte,"Ciliated, Goblet, Lymphatic, Mesothelial, Capillary, Alveolar Epithelial Type 1"
1797,1797,1797,1797,Lung,4,0.75,"CD7,S100A6,ZFP36L2,CEBPB,CTSW,CCL5,LGALS1",Natural Killer T,,,t/nk cell,Natural Killer,"Natural Killer, Goblet, Basal, Macrophage, CD8+ Memory/Effector T, CD8+ Naive T",Natural Killer,"Alveolar Fibroblast, Proliferating NK/T, Natural Killer T, Adventitial Fibroblast"
1798,1798,1798,1798,Lung,4,0.75,"HSPB3,RAMP1,FAM150A,CSRP1,CST5,IGF1,CLU",Fibromyocyte,,,muscle cell,Fibromyocyte,"Alveolar Fibroblast, Natural Killer T, Fibromyocyte, Alveolar Epithelial Type 1, Fibromyocyte",Fibromyocyte,"Alveolar Fibroblast, Proliferating Macrophage"
1799,1799,1799,1799,Lung,4,0.75,"AGR2,GABRP,S100P,CLIC1,WFDC2,PSCA,CXCL17",Goblet,goblet cell,CL:0000160,epithelial cell,Goblet,"Ciliated, Goblet, Differentiating Basal, Basophil/Mast 1, Platelet/Megakaryocyte",Goblet,"Ciliated, Proximal Ciliated, Goblet, Natural Killer T, Myeloid Dendritic Type 1"
1800,1800,1800,1800,Lung,4,0.75,"TFF3,FOXI1,PHGR1,ASCL3,MFSD6L,STAC2,TMPRSS11E",Ionocyte,ionocyte,CL:0005006,epithelial cell,"Goblet, Ionocyte",Ionocyte,Proximal Ciliated,Ionocyte
1801,1801,1801,1801,Lung,4,0.75,"FAM46A,CHGA,NENF,BEX1,PRDX2,SEC11C,CPE",Neuroendocrine,neuroendocrine cell,CL:0000165,epithelial cell,Neuroendocrine,Neuroendocrine,Neuroendocrine,Neuroendocrine
1802,1802,1802,1802,Lung,4,0.75,"LYZ,PRB3,TCN1,TESC,LPO,PRH2,PHB",Serous,serous secreting cell,CL:0000313,secretory cell,Serous,Serous,Serous,Proliferating Macrophage
1803,1803,1803,1803,Lung,4,0.75,"CTSZ,C1QB,FCER1G,LAPTM5,AIF1,C1QC,C1QA",Macrophages,macrophage,CL:0000235,macrophage/monocyte,"Macrophage, IGSF21+ Dendritic, TREM2+ Dendritic",Macrophage,Myeloid Dendritic Type 2,Macrophage
1804,1804,1804,1804,Lung,4,0.75,"CST7,NKG7,CCL4,CTSW,GZMA,CD7,GZMB",Innate lymphoid cell NK,natural killer cell,CL:0000623,t/nk cell,"Natural Killer, CD8+ Memory/Effector T",Natural Killer,Natural Killer,"CD8+ Memory/Effector T, CD8+ Naive T"
1805,1805,1805,1805,Lung,4,0.75,"MUC1,SLC34A2,CYB5A,S100A14,SFTA3,SFTPD,PEBP4",AT2,type II pneumocyte,CL:0002063,epithelial cell,Alveolar Epithelial Type 2,Alveolar Epithelial Type 2,Alveolar Epithelial Type 2,Signaling Alveolar Epithelial Type 2
1806,1806,1806,1806,Lung,4,0.75,"GNG11,IGFBP7,CLEC14A,MGP,VWF,SPARCL1,RAMP3",EC venous,vein endothelial cell,CL:0002543,endothelial cell,"Vein, Artery, Lymphatic",Artery,Platelet/Megakaryocyte,Natural Killer
1807,1807,1807,1807,Lung,4,0.75,"CXCR4,IL32,TRBC2,CD2,CCL5,CD69,TRAC",T cell lineage,T cell,CL:0000084,t/nk cell,"CD8+ Memory/Effector T, CD4+ Memory/Effector T",CD8+ Memory/Effector T,CD8+ Memory/Effector T,CD4+ Memory/Effector T
1808,1808,1808,1808,Lung,4,0.75,"GIMAP7,IFI27,CRIP2,CLEC14A,TM4SF1,A2M,SOX17",EC arterial,endothelial cell of artery,CL:1000413,endothelial cell,"Artery, Alveolar Epithelial Type 1",Artery,Capillary,"CD8+ Memory/Effector T, Proliferating NK/T"
1809,1809,1809,1809,Lung,4,0.75,"DCN,COL1A2,COL6A1,C1S,MGP,LUM,CALD1",Fibroblasts,fibroblast,CL:0000057,fibroblast,"Adventitial Fibroblast, Alveolar Fibroblast",Adventitial Fibroblast,Adventitial Fibroblast,Myeloid Dendritic Type 1
1810,1810,1810,1810,Lung,4,0.75,"CEACAM6,ADIRF,CAV1,FXYD3,TSPAN13,KRT7,SFTA2",AT1,type I pneumocyte,CL:0002062,epithelial cell,Alveolar Epithelial Type 1,"Alveolar Epithelial Type 1, Signaling Alveolar Epithelial Type 2, Club, Bronchial Vessel 1, Platelet/Megakaryocyte",Signaling Alveolar Epithelial Type 2,"Alveolar Epithelial Type 2, Signaling Alveolar Epithelial Type 2, Capillary Aerocyte"
1811,1811,1811,1811,Lung,4,0.75,"C11orf97,TMEM231,RP11-356K23.1,C12orf75,SNTN,CD24,FAM229B",Multiciliated lineage,multi-ciliated epithelial cell,CL:0005012,epithelial cell,Ciliated,"Ciliated, Proximal Ciliated, Bronchial Vessel 1, Platelet/Megakaryocyte",Alveolar Epithelial Type 1,Ciliated
1812,1812,1812,1812,Lung,4,0.75,"CD37,IGLC2,IGHA1,TSC22D3,CORO1A,CD79A,IGKC",B cell lineage,B cell,CL:0000236,b cell,B,"B, CD4+ Memory/Effector T, Natural Killer T",Natural Killer T,"B, Proliferating Basal, Mesothelial"
1813,1813,1813,1813,Lung,4,0.75,"WFDC2,TACSTD2,PIGR,CEACAM6,CXCL17,KRT7,BPIFB1",Secretory,secretory cell,CL:0000151,secretory cell,Goblet,"Differentiating Basal, Goblet, Mucous, Club, Alveolar Epithelial Type 2, Signaling Alveolar Epithelial Type 2, Platelet/Megakaryocyte",Mucous,"Goblet, Alveolar Epithelial Type 1, Ionocyte"
1814,1814,1814,1814,Lung,4,0.75,"FCER1G,S100A8,LST1,S100A12,COTL1,S100A9,VCAN",Monocytes,monocyte,CL:0000576,macrophage/monocyte,Classical Monocyte,"Mesothelial, Basal, Classical Monocyte, OLR1+ Classical Monocyte, Nonclassical Monocyte, Intermediate Monocyte",Classical Monocyte,"Plasmacytoid Dendritic, Lymphatic, Myeloid Dendritic Type 1, Intermediate Monocyte"
1815,1815,1815,1815,Lung,4,0.75,"PIP,AZGP1,MARCKSL1,ZG16B,SEC11C,TCN1,LTF",Submucosal Secretory,,,secretory cell,Serous,"Ciliated, Goblet, Mucous, Serous, Ionocyte, Neuroendocrine, Platelet/Megakaryocyte",Goblet,Heavy Regulated Engaged Monocyte
1816,1816,1816,1816,Lung,4,0.75,"IFI27,CLDN5,SPARCL1,PECAM1,AQP1,CLEC14A,EGFL7",EC capillary,capillary endothelial cell,CL:0002144,endothelial cell,Capillary Aerocyte,"Ciliated, Capillary Aerocyte, Capillary Intermediate 1, Bronchial Vessel 1, Capillary Intermediate 2, Macrophage, Proliferating Macrophage, Classical Monocyte, Nonclassical Monocyte, Intermediate Monocyte",Capillary Aerocyte,"Macrophage, Natural Killer, Proliferating Macrophage, Vascular Smooth Muscle"
1817,1817,1817,1817,Lung,4,0.75,"PPFIBP1,CCL21,CLDN5,GNG11,RAMP2,IGFBP7,SDPR",Lymphatic EC mature,,,endothelial cell,Lymphatic,"Alveolar Epithelial Type 1, Lymphatic, Capillary Aerocyte, Capillary, Ionocyte, Mesothelial, Plasma",Lymphatic,"Lymphatic, Alveolar Epithelial Type 1, T helper Cells, Mesothelial, Club"
1818,1818,1818,1818,Lung,4,0.75,"CLDN5,TIMP3,AKAP12,CCL21,TFF3,SDPR,TCF4",Lymphatic EC differentiating,,,endothelial cell,Capillary Intermediate 1,"Neuroendocrine, Capillary Aerocyte, Capillary, Capillary Intermediate 1, Alveolar Fibroblast, Lymphatic, Proximal Ciliated, Goblet, Mucous, Ionocyte, Neuroendocrine, Lymphatic",Capillary,"Plasmacytoid Dendritic, Monocyte, IGSF21+ Dendritic"
1819,1819,1819,1819,Lung,4,0.75,"HLA-DPB1,HLA-DPA1,HLA-DQB1,MS4A6A,HLA-DMA,HLA-DQA1,GPR183",Dendritic cells,dendritic cell,CL:0000451,dendritic cell,Alveolar Epithelial Type 2,"Club, Alveolar Epithelial Type 2, Signaling Alveolar Epithelial Type 2, Capillary Aerocyte, Capillary, Capillary Intermediate 1, Mesothelial, Macrophage, Proliferating Macrophage, Myeloid Dendritic Type 1, Myeloid Dendritic Type 2, IGSF21+ Dendritic, EREG+ Dendritic, TREM2+ Dendritic, Intermediate Monocyte",Macrophage,"Macrophage, Classical Monocyte, Nonclassical Monocyte, Myeloid Dendritic Type 2"
1820,1820,1820,1820,Lung,4,0.75,"CYR61,TPM2,IGFBP5,CALD1,MT1X,PRELP,CTGF",Myofibroblasts,myofibroblast cell,CL:0000186,myofibroblast cell,"Alveolar Epithelial Type 1, Myofibroblast, Pericyte, Basal, Airway Smooth Muscle, Plasma, Vascular Smooth Muscle","Alveolar Epithelial Type 1, Airway Smooth Muscle, Vascular Smooth Muscle, Basal",Alveolar Epithelial Type 1,Alveolar Fibroblast
1821,1821,1821,1821,Lung,4,0.75,"KIT,MS4A2,RGS13,TPSB2,GATA2,C1orf186,CPA3",Mast cells,mast cell,CL:0000097,granulocyte,"Basophil/Mast 1, Basophil/Mast 2","Ionocyte, Basophil/Mast 1, Basophil/Mast 2",Basophil/Mast,Basophil/Mast 1
