234,234,234,234,Lung,1,0.5,"AIF1,LST1,MS4A6A,CD163,RNASE6",non-classical monocyte,non-classical monocyte,CL:0000875,macrophage/monocyte,Myeloid Dendritic Type 2,"Classical Monocyte, Classical Monocyte, Classical Monocyte, Classical Monocyte, Classical Monocyte",Monocytes,Macrophage
235,235,235,235,Lung,1,0.5,"TIMP3,CALCRL,SLC6A4,LRRC32,VWF",capillary endothelial cell,capillary endothelial cell,CL:0002144,endothelial cell,Vein,"Alveolar Epithelial Type 1, Vein, Alveolar Epithelial Type 1, Artery, Vein",Vein,Vascular Smooth Muscle
236,236,236,236,Lung,1,0.5,"IL1RL1,CLDN5,HPGD,RAMP2,TIMP3",capillary aerocyte,,,epithelial cell,Capillary Aerocyte,"Basophil/Mast 2, Capillary, Capillary, Artery, Capillary",Capillary Aerocyte,Capillary
237,237,237,237,Lung,1,0.5,"UPK3B,NTM,ITLN2,PKDCC,ST6GALNAC5",type i pneumocyte,type I pneumocyte,CL:0002062,epithelial cell,Alveolar Epithelial Type 1,"Alveolar Epithelial Type 1, Alveolar Epithelial Type 1, Alveolar Epithelial Type 1, Capillary, Alveolar Epithelial Type 1",Alveolar Epithelial Type 1,Alveolar Epithelial Type 1
238,238,238,238,Lung,1,0.5,"TIMP3,PRSS23,SPARCL1,LIFR,IGFBP7",vein endothelial cell,vein endothelial cell,CL:0002543,endothelial cell,Alveolar Fibroblast,"Alveolar Epithelial Type 1, Vein, Myofibroblast, Artery, Ciliated",Mixture of Various Cell Types,Fibroblast
239,239,239,239,Lung,1,0.5,"MGP,FBLN1,LUM,RARRES2,ADH1B",alveolar fibroblast,,,fibroblast,Alveolar Fibroblast,"Club, Adventitial Fibroblast, Adventitial Fibroblast, Alveolar Epithelial Type 1, Adventitial Fibroblast",Adventitial Fibroblast,Alveolar Fibroblast
240,240,240,240,Lung,1,0.5,"MMRN1,HOXD9,PROX1,SEMA3D,STAB2",endothelial cell of lymphatic vessel,endothelial cell of lymphatic vessel,CL:0002138,endothelial cell,Lymphatic,"Lymphatic, Vein",Lymphatic,Vein
241,241,241,241,Lung,1,0.5,"PLAC9,CARMN,CNN1,LMOD1,DES",bronchial smooth muscle cell,bronchial smooth muscle cell,CL:0002598,muscle cell,Vascular Smooth Muscle,"Airway Smooth Muscle, Vascular Smooth Muscle, Artery, Vein",Airway Smooth Muscle,"Lymphatic, Vascular Smooth Muscle, Airway Smooth Muscle"
242,242,242,242,Lung,1,0.5,"PLD4,LAMP5,LILRA4,MZB1,SPIB",plasmacytoid dendritic cell,plasmacytoid dendritic cell,CL:0000784,dendritic cell,Plasmacytoid Dendritic,"Plasmacytoid Dendritic, Myofibroblast",Plasmacytoid Dendritic,"Plasmacytoid Dendritic, B, Plasmacytoid Dendritic"
243,243,243,243,Lung,1,0.5,"NEDD4L,WFDC2,CEACAM6,ELF3,FOLR1",club cell,club cell,CL:0000158,epithelial cell,Alveolar Epithelial Type 1,"Alveolar Epithelial Type 1, Goblet, Differentiating Basal, Platelet/Megakaryocyte",Goblet,"Alveolar Epithelial Type 1, Signaling Alveolar Epithelial Type 2, Goblet"
244,244,244,244,Lung,1,0.5,"IGFBP7,LIFR,CLU,NPDC1,VWF",lung microvascular endothelial cell,lung microvascular endothelial cell,CL:2000016,endothelial cell,Vein,"Basal, Vein, Lymphatic, Airway Smooth Muscle, Vascular Smooth Muscle, Ciliated, Alveolar Epithelial Type 1",Vein,"Vein, Artery, Platelet/Megakaryocyte, Signaling Alveolar Epithelial Type 2"
245,245,245,245,Lung,1,0.5,"COX4I2,PRELP,CCN5,GJA4,BGN",vascular associated smooth muscle cell,vascular associated smooth muscle cell,CL:0000359,muscle cell,Pericyte,"Vascular Smooth Muscle, Myofibroblast, Alveolar Fibroblast, Artery, Capillary, Pericyte",Pericyte,"Vascular Smooth Muscle, Fibromyocyte, Airway Smooth Muscle"
246,246,246,246,Lung,1,0.5,"RSPO1,KCTD8,LINC01902,GPR1,SYT4",myofibroblast cell,myofibroblast cell,CL:0000186,myofibroblast cell,Neuroendocrine,"Alveolar Fibroblast, Neuroendocrine",Neuroendocrine,"Pericyte, Neuroendocrine, Vascular Smooth Muscle"
247,247,247,247,Lung,1,0.5,"NDUFA4L2,RGN,INMT,PDGFRB,COX4I2",pericyte cell,pericyte,CL:0000669,pericyte,Pericyte,"Pericyte, Alveolar Fibroblast, Capillary Aerocyte",Pericyte,"Alveolar Fibroblast, Mesothelial"
248,248,248,248,Lung,1,0.5,"PRG4,CPB1,SYT4,HAS1,VIPR2",mesothelial cell,mesothelial cell,CL:0000077,epithelial cell,Plasmacytoid Dendritic,"Alveolar Fibroblast, Mesothelial, Neuroendocrine, Adventitial Fibroblast, Lipofibroblast, Plasmacytoid Dendritic",Alveolar Fibroblast,"Adventitial Fibroblast, Myofibroblast"
249,249,249,249,Lung,1,0.5,"TARID,AC009269.2,COL1A2,ABCA6,SGIP1",fibroblast,fibroblast,CL:0000057,fibroblast,Adventitial Fibroblast,"Adventitial Fibroblast, Myofibroblast, Lipofibroblast, Alveolar Fibroblast, Pericyte",Adventitial Fibroblast,"Lymphatic, Pericyte"
250,250,250,250,Lung,1,0.5,"CD300E,CORO1A,RNASE2,VCAN,FCN1",intermediate monocyte,intermediate monocyte,CL:0002393,macrophage/monocyte,"Classical Monocyte, OLR1+ Classical Monocyte, Intermediate Monocyte","Classical Monocyte, Nonclassical Monocyte, Intermediate Monocyte",Classical Monocyte,"Nonclassical Monocyte, Classical Monocyte, TREM2+ Dendritic, Intermediate Monocyte"
251,251,251,251,Lung,1,0.5,"CLCNKB,LINC01187,CEL,DGKI,PROX1",pulmonary ionocyte,pulmonary ionocyte,CL:0017000,epithelial cell,Ionocyte,Ionocyte,Ionocyte,Ionocyte
252,252,252,252,Lung,1,0.75,"LMO7,LAMA3,SCEL,EMP2,GPRC5A,DST,AGER",Alveolar Epithelial Type 1,type I pneumocyte,CL:0002062,epithelial cell,Alveolar Epithelial Type 1,Alveolar Epithelial Type 1,Alveolar Epithelial Type 1,Alveolar Epithelial Type 1
253,253,253,253,Lung,1,0.75,"ADAM28,BLK,VPREB3,MS4A1,CD79B,CD22,LINC00926",B,B cell,CL:0000236,b cell,B,"Proximal Basal, B",B,"B, Myeloid Dendritic Type 1, Memory T, Naive T"
254,254,254,254,Lung,1,0.75,"ITGA2,KRT15,DST,FHL2,PERP,KRT5,S100A2",Basal,basal cell,CL:0000646,stem cell,"Basal, Proximal Basal, Proliferating Basal","Basal, Proximal Basal, Proliferating Basal",Basal,"Basal, Alveolar Epithelial Type 1"
255,255,255,255,Lung,1,0.75,"VCAN,S100A12,S100A9,CTSS,METTL9,CD99,FCN1",CD14+ Monocyte,CD14-positive monocyte,CL:0001054,macrophage/monocyte,"Classical Monocyte, OLR1+ Classical Monocyte, Intermediate Monocyte","Classical Monocyte, OLR1+ Classical Monocyte, Intermediate Monocyte",Classical Monocyte,"Classical Monocyte, Nonclassical Monocyte, OLR1+ Classical Monocyte"
256,256,256,256,Lung,1,0.75,"MALAT1,CD6,CAMK4,BCL11B,IL7R,TRAT1,MAL",CD4 T,"CD4-positive, alpha-beta T cell",CL:0000624,t/nk cell,"Capillary, Capillary Intermediate 1, Capillary Intermediate 2, CD8+ Memory/Effector T, CD8+ Naive T, CD4+ Memory/Effector T, CD4+ Naive T, Natural Killer T","CD8+ Memory/Effector T, CD8+ Naive T, CD4+ Memory/Effector T, Natural Killer T",CD4+ Memory/Effector T,"Memory T, Naive T"
257,257,257,257,Lung,1,0.75,"FAM92B,C20orf85,CCDC170,FANK1,RSPH1,CDHR3,ZMYND10",Ciliated,ciliated cell,CL:0000064,ciliated cell,"Proximal Ciliated, Platelet/Megakaryocyte","Ciliated, Proximal Ciliated",Ciliated,"Ciliated, Proximal Ciliated"
258,258,258,258,Lung,1,0.75,"HLA-DPB1,FPR3,RGS1,CLEC10A,HLA-DMB,MS4A6A,HLA-DQA1",Dendritic,dendritic cell,CL:0000451,dendritic cell,"Myeloid Dendritic Type 1, Myeloid Dendritic Type 2, IGSF21+ Dendritic, EREG+ Dendritic, TREM2+ Dendritic, B","Myeloid Dendritic Type 1, Myeloid Dendritic Type 2, IGSF21+ Dendritic, EREG+ Dendritic, TREM2+ Dendritic, Intermediate Monocyte",Myeloid Dendritic Type 1,"Myeloid Dendritic Type 2, EREG+ Dendritic, Plasmacytoid Dendritic, Myeloid Dendritic Type 1"
259,259,259,259,Lung,1,0.75,"ADH1B,SLIT2,ABLIM1,C3,C1R,LUM,CFD",Fibroblast,fibroblast,CL:0000057,fibroblast,"Adventitial Fibroblast, Alveolar Fibroblast, Lipofibroblast","Adventitial Fibroblast, Alveolar Fibroblast",Adventitial Fibroblast,"Alveolar Fibroblast, Adventitial Fibroblast"
260,260,260,260,Lung,1,0.75,"IGFBP7,TFF3,CCL21,PKHD1L1,PPFIBP1,TBX1,TFPI",Lymphatic,,,immune cell,Lymphatic,"Proximal Ciliated, Lymphatic, Alveolar Epithelial Type 1",Lymphatic,"Proximal Ciliated, Goblet, Lymphatic, Adventitial Fibroblast, Macrophage"
261,261,261,261,Lung,1,0.75,"APOC1,VSIG4,ACP5,OLR1,ITGAX,MARCO,GPD1",Macrophage,macrophage,CL:0000235,macrophage/monocyte,Macrophage,"Macrophage, TREM2+ Dendritic",Macrophage-TREM2+ Dendritic,"Signaling Alveolar Epithelial Type 2, Macrophage, TREM2+ Dendritic, OLR1+ Classical Monocyte"
262,262,262,262,Lung,1,0.75,"SPON2,KLRD1,PRF1,GZMB,GNLY,KLRF1,CD247",Natural Killer,natural killer cell,CL:0000623,t/nk cell,Natural Killer,"CD8+ Memory/Effector T, CD8+ Naive T, Natural Killer T, Natural Killer, Proliferating NK/T",Natural Killer + T Cell Mix,"CD8+ Memory/Effector T, Natural Killer, Proliferating NK/T, TREM2+ Dendritic"
263,263,263,263,Lung,1,0.75,"XBP1,POU2AF1,DERL3,MZB1,TNFRSF17,SSR4,SEC11C",Plasma,plasma cell,CL:0000786,b cell,Plasma,"Goblet, Mucous, Plasma, Plasmacytoid Dendritic",Plasma,"Goblet, Plasma, Macrophage, B"
264,264,264,264,Lung,1,0.75,"NAPSA,SFTPB,SFTPC,SFTPA1,SLC34A2,LPCAT1,LAMP3",Alveolar Epithelial Type 2,type II pneumocyte,CL:0002063,epithelial cell,Alveolar Epithelial Type 2,"Alveolar Epithelial Type 2, Club",Alveolar Epithelial Type 2,"Alveolar Epithelial Type 2, Signaling Alveolar Epithelial Type 2, Natural Killer"
265,265,265,265,Lung,1,0.75,"CD44,CPA3,GATA2,MS4A2,HDC,HPGDS,TPSAB1",Basophil/Mast,"basophil,mast cell","CL:0000767,CL:0000097",granulocyte,Basophil/Mast,"Alveolar Epithelial Type 2, Basophil/Mast 1, Capillary, Basophil/Mast 2",Basophil/Mast,"Basophil/Mast 1, Basophil/Mast 2, Classical Monocyte"
266,266,266,266,Lung,1,0.75,"COTL1,RHOC,AIF1,IFITM2,SAT1,RPS19,FCN1",CD16+ Monocyte,,,macrophage/monocyte,Myofibroblast,"Bronchial Vessel 1, Basal, Macrophage, Nonclassical Monocyte",Monocyte/Myeloid Dendritic,"Myofibroblast, Basal, Vascular Smooth Muscle"
267,267,267,267,Lung,1,0.75,"EPAS1,CDC42EP1,CD81,BTNL9,CDH5,PODXL,RAMP3",Capillary,,,blood vessel cell,Capillary,"Basal, Proximal Basal, Differentiating Basal, Alveolar Epithelial Type 1, Vein, Capillary",Capillary,"Capillary, CD8+ Naive T, Natural Killer"
268,268,268,268,Lung,1,0.75,"NKG7,CD3D,RPS27,CCL5,CD3G,GZMH,CD8B",CD8 T,"CD8-positive, alpha-beta T cell",CL:0000625,t/nk cell,CD8+ Memory/Effector T,"CD8+ Memory/Effector T, CD8+ Naive T, CD4+ Memory/Effector T, CD4+ Naive T",Natural Killer T,"CD8+ Memory/Effector T, CD4+ Memory/Effector T, Natural Killer T, TREM2+ Dendritic"
269,269,269,269,Lung,1,0.75,"KIAA1324,CEACAM6,CYB5A,SFTPB,C16orf89,DSTN,SCGB3A2",Club,club cell,CL:0000158,epithelial cell,Club,"Club, Goblet, Alveolar Epithelial Type 2, Signaling Alveolar Epithelial Type 2, Macrophage, Fibromyocyte",Club/Goblet,"Alveolar Epithelial Type 2, Club, Signaling Alveolar Epithelial Type 2, Plasma, Macrophage"
270,270,270,270,Lung,1,0.75,"COL6A3,POSTN,LTBP1,CALD1,ASPN,ITGBL1,COL1A1",Myofibroblast,myofibroblast cell,CL:0000186,myofibroblast cell,Myofibroblast,"Adventitial Fibroblast, Vascular Smooth Muscle, Myofibroblast, Basal","Adventitial Fibroblast, Myofibroblast, Fibromyocyte",Fibromyocyte
271,271,271,271,Lung,1,0.75,"PTPRE,PLD4,PPP1R14B,NPC2,IRF4,GZMB,SEC61B",Plasmacytoid Dendritic,plasmacytoid dendritic cell,CL:0000784,dendritic cell,Plasmacytoid Dendritic,"Alveolar Epithelial Type 1, Plasmacytoid Dendritic, Proliferating Basal, Signaling Alveolar Epithelial Type 2","Plasmacytoid Dendritic, Myeloid Dendritic Type 1",Plasmacytoid Dendritic
272,272,272,272,Lung,1,0.75,"TYMS,H2AFZ,ANLN,STMN1,KPNA2,TPX2,BIRC5",Proliferating Macrophage,,,macrophage/monocyte,Proliferating Basal,"Proliferating Basal, Proliferating NK/T, Proliferating Macrophage","Proliferating Basal, Proliferating NK/T, Proliferating Macrophage",Proliferating Macrophage
273,273,273,273,Lung,1,0.75,"CENPF,UBE2C,NUSAP1,AURKB,TOP2A,KIF2C,BIRC5",Proliferating NK/T,,,t/nk cell,Proliferating Macrophage,"Proliferating Basal, Proliferating NK/T, Proliferating Macrophage","Proliferating Basal, Proliferating NK/T, Proliferating Macrophage",Proliferating Basal
274,274,274,274,Lung,1,0.75,"PLVAP,INHBB,ZNF385D,ENPP2,COL15A1,SPARCL1,EMCN",Bronchial Vessel,,,bronchial cell,Bronchial Vessel 1,"Bronchial Vessel 1, Ciliated, Fibromyocyte, Artery, Myofibroblast","Bronchial Vessel 1, Bronchial Vessel 2",Mucous
275,275,275,275,Lung,1,0.75,"LCN2,WFDC2,SAA1,BPIFB1,SLPI,SCGB3A1,MUC5B",Mucous,,,mucosal cell,Mucous,"Goblet, Differentiating Basal, Mucous, Serous, Platelet/Megakaryocyte","Goblet, Mucous, Serous",Goblet
276,276,276,276,Lung,1,0.75,"PLA1A,VWF,PRSS23,SELP,TGM2,SLCO2A1,CPE",Vein,,,blood vessel cell,Vein,"Vein, Vascular Smooth Muscle, Platelet/Megakaryocyte, Mucous, Artery",Vein,Bronchial Vessel 2
277,277,277,277,Lung,1,0.75,"COL4A2,COX4I2,COL4A1,CALD1,CHN1,LAMC3,NID1",Pericyte,pericyte,CL:0000669,pericyte,Pericyte,"Alveolar Epithelial Type 1, Vascular Smooth Muscle, Alveolar Epithelial Type 1, Vascular Smooth Muscle, Pericyte","Alveolar Epithelial Type 1, Alveolar Epithelial Type 1",Airway Smooth Muscle
278,278,278,278,Lung,1,0.75,"CNN1,DES,ACTA2,CSRP1,DSTN,CALD1,PLN",Smooth Muscle,smooth muscle cell,CL:0000192,muscle cell,Vascular Smooth Muscle,"Airway Smooth Muscle, Vascular Smooth Muscle, Fibromyocyte, Basal, Alveolar Epithelial Type 1","Airway Smooth Muscle, Vascular Smooth Muscle",Pericyte
279,279,279,279,Lung,1,0.75,"GJA5,FBLN5,SEMA3G,EPAS1,EFNB2,BMX,HEY1",Artery,,,blood vessel cell,Artery,"Artery, Alveolar Epithelial Type 1, Artery, Basal, Ionocyte, Artery",Artery,Vascular Smooth Muscle
280,280,280,280,Lung,1,0.75,"CYP3A5,ESAM,APP,EDNRB,HPGD,STXBP6,TBX2",Capillary Aerocyte,,,epithelial cell,Capillary Aerocyte,"Alveolar Epithelial Type 2, Capillary Aerocyte, Capillary, Capillary Intermediate 1, Ciliated, Bronchial Vessel 2, Airway Smooth Muscle, Vascular Smooth Muscle, Pericyte, Platelet/Megakaryocyte",Capillary Aerocyte,"Alveolar Fibroblast, Capillary Aerocyte, Adventitial Fibroblast, Airway Smooth Muscle, Basal, Alveolar Epithelial Type 2"
281,281,281,281,Lung,1,0.75,"RALA,ACVRL1,SRSF11,SH3BP5,WWTR1,EPAS1,IPO7",Capillary Intermediate,,,blood vessel cell,Capillary Aerocyte,"Ionocyte, Alveolar Epithelial Type 1, Capillary, Capillary Intermediate 2, Club, Signaling Alveolar Epithelial Type 2, Vein, Myeloid Dendritic Type 1, Myeloid Dendritic Type 2, EREG+ Dendritic, TREM2+ Dendritic, OLR1+ Classical Monocyte",Ionocyte Capillary Intermediate 1 with potential involvement of other components like Capillary Intermediate 2 due to common signaling pathways,"Alveolar Epithelial Type 1, Capillary Aerocyte, Adventitial Fibroblast, Neuroendocrine, Fibromyocyte"
282,282,282,282,Lung,1,0.75,"MEDAG,C7,C3,STEAP1,HAS1,FGF7,CCDC71L",Lipofibroblast,alveolar type 1 fibroblast cell,CL:4028004,fibroblast,Adventitial Fibroblast,"Lymphatic, Adventitial Fibroblast, Lipofibroblast, Mesothelial, Goblet, Mucous, Alveolar Epithelial Type 2, Signaling Alveolar Epithelial Type 2",Adventitial Fibroblast Mesothelial,"Adventitial Fibroblast, Macrophage, Lipofibroblast, Basophil/Mast 2, Mucous"
283,283,283,283,Lung,1,0.75,"ALDH1A3,PRG4,DSC3,WT1,MGARP,DMKN,SLPI",Mesothelial,mesothelial cell,CL:0000077,epithelial cell,Mesothelial,"Basal, Mucous, Adventitial Fibroblast, Lipofibroblast, Mesothelial, Proximal Basal, Proliferating Basal",Mesothelial Alveolar Fibroblast Lipofibroblast,"Alveolar Fibroblast, Basal, Mucous"
284,284,284,284,Lung,1,0.75,"GP9,TUBB1,CABP5,ACRBP,GP6,TMEM40,PF4",Platelet/Megakaryocyte,"platelet,megakaryocyte","CL:0000233,CL:0000556","platelet,megakaryocyte",Platelet/Megakaryocyte,Platelet/Megakaryocyte,Platelet/Megakaryocyte,Platelet/Megakaryocyte
285,285,285,285,Lung,1,0.75,"CCL5,CD7,GNLY,LGALS1,S100A6,CTSW,CEBPB",Natural Killer T,,,t/nk cell,Natural Killer,"CD8+ Memory/Effector T, CD8+ Naive T, Natural Killer T, Natural Killer, Proliferating NK/T, Ciliated, Basal, Neuroendocrine, Capillary Aerocyte, Capillary Intermediate 2, Lymphatic, Mesothelial, Macrophage, Proliferating Macrophage, Myeloid Dendritic Type 1, Myeloid Dendritic Type 2, EREG+ Dendritic, TREM2+ Dendritic, Classical Monocyte, OLR1+ Classical Monocyte",Natural Killer Natural Killer T Macrophage,"Natural Killer T, Natural Killer, CD8+ Memory/Effector T, CD8+ Naive T, Classical Monocyte, Basophil/Mast 1"
286,286,286,286,Lung,1,0.75,"HSPB3,CLU,RAMP1,CSRP1,CST5,SCX,MET",Fibromyocyte,,,muscle cell,Fibromyocyte,"Fibromyocyte, Alveolar Fibroblast, Ciliated, Proximal Ciliated, Neuroendocrine, Signaling Alveolar Epithelial Type 2, Airway Smooth Muscle",Fibromyocyte,"Neuroendocrine, Fibromyocyte, Alveolar Epithelial Type 1"
287,287,287,287,Lung,1,0.75,"WFDC2,TXN,CXCL17,AGR2,COX5A,CLIC1,FAM3D",Goblet,goblet cell,CL:0000160,epithelial cell,Goblet,"Differentiating Basal, Goblet, Mucous, Serous, Mesothelial, Platelet/Megakaryocyte, Proximal Ciliated, Proximal Basal, Ionocyte, Lymphatic, Adventitial Fibroblast",Goblet Basophil/Mast 2,"Ionocyte, Proximal Basal, Ciliated"
288,288,288,288,Lung,1,0.75,"TMPRSS11E,MFSD6L,FOXI1,ASCL3,STAC2,ATP6V1B1,TFF3",Ionocyte,ionocyte,CL:0005006,epithelial cell,Ionocyte,"Ciliated, Basal, Proximal Basal, Ionocyte, Proximal Ciliated, Differentiating Basal, Proliferating Basal, Goblet, Lymphatic, Adventitial Fibroblast, Mesothelial, Macrophage, Proliferating Macrophage, Plasmacytoid Dendritic, Myeloid Dendritic Type 1, Myeloid Dendritic Type 2, TREM2+ Dendritic",Ionocyte,"Ciliated, Neuroendocrine, Natural Killer T, Alveolar Epithelial Type 1, Lipofibroblast, Myeloid Dendritic Type 2"
289,289,289,289,Lung,1,0.75,"PCSK1N,FAM46A,SCGN,SEC11C,CPE,PRDX2,CHGA",Neuroendocrine,neuroendocrine cell,CL:0000165,epithelial cell,Neuroendocrine,"Ciliated, Ionocyte, Neuroendocrine, Myofibroblast, Fibromyocyte, Serous, Ionocyte, Neuroendocrine, Artery, Plasma, Plasmacytoid Dendritic, Vein, Airway Smooth Muscle, Vascular Smooth Muscle, Adventitial Fibroblast, Macrophage, Proliferating Macrophage",Neuroendocrine,"Platelet/Megakaryocyte, Macrophage, Natural Killer, Alveolar Epithelial Type 1, Dendritic"
290,290,290,290,Lung,1,0.75,"TCN1,TESC,PHB,PRH2,PRB3,LYZ,PRB4",Serous,serous secreting cell,CL:0000313,secretory cell,Serous,Serous,Serous,Macrophage
291,291,291,291,Lung,1,0.75,"C1QB,HLA-DRB1,FCER1G,CTSZ,AIF1,LAPTM5,C1QA",Macrophages,macrophage,CL:0000235,macrophage/monocyte,"Macrophage, Myeloid Dendritic Type 2, Classical Monocyte, Nonclassical Monocyte","Macrophage, Dendritic Cells",Macrophage,Macrophage
292,292,292,292,Lung,1,0.75,"GZMA,GNLY,CD7,CST7,GZMB,NKG7,CCL4",Innate lymphoid cell NK,natural killer cell,CL:0000623,t/nk cell,"Natural Killer, CD8+ Naive T","Natural Killer, T Cells",Natural Killer,CD8+ Memory/Effector T
293,293,293,293,Lung,1,0.75,"S100A14,NAPSA,SFTA3,CYB5A,SLC34A2,SLC39A8,SFTPD",AT2,type II pneumocyte,CL:0002063,epithelial cell,Alveolar Epithelial Type 2,"Alveolar Epithelial Type 1, Alveolar Epithelial Type 2",Alveolar Epithelial Type 2,Alveolar Epithelial Type 2
294,294,294,294,Lung,1,0.75,"GNG11,IGFBP7,ACKR1,CLEC14A,SPARCL1,RAMP2,RAMP3",EC venous,vein endothelial cell,CL:0002543,endothelial cell,"Capillary Aerocyte, Bronchial Vessel","Lymphatic, Bronchial Vessel 1, Artery",Bronchial Vessel 1,Bronchial Vessel 1
295,295,295,295,Lung,1,0.75,"CORO1A,CD3E,CD69,CD3D,CD2,TRBC2,CCL5",T cell lineage,T cell,CL:0000084,t/nk cell,"CD8+ Memory/Effector T, Natural Killer T",T Cells,CD8+ Memory/Effector T,CD4+ Memory/Effector T
296,296,296,296,Lung,1,0.75,"IFI27,SOX17,PECAM1,CRIP2,A2M,TM4SF1,CLEC14A",EC arterial,endothelial cell of artery,CL:1000413,endothelial cell,"Artery, Capillary Intermediate","Artery, Bronchial Vessel 1, Alveolar Epithelial Type 1, Macrophage",Alveolar Fibroblast,Alveolar Epithelial Type 1
297,297,297,297,Lung,1,0.75,"CALD1,MGP,COL6A1,IGFBP7,LUM,COL1A2,C1S",Fibroblasts,fibroblast,CL:0000057,fibroblast,"Myofibroblast, Alveolar Fibroblast","Vascular Smooth Muscle, Artery, Adventitial Fibroblast, Alveolar Fibroblast",Adventitial Fibroblast,Alveolar Fibroblast
298,298,298,298,Lung,1,0.75,"SFTA2,HOPX,FXYD3,CAV1,TSPAN13,KRT7,EMP2",AT1,type I pneumocyte,CL:0002062,epithelial cell,"Alveolar Epithelial Type 1, Alveolar Epithelial Type 2","Alveolar Epithelial Type 1, Vascular Smooth Muscle, Ciliated",Alveolar Epithelial Type 1,Capillary
299,299,299,299,Lung,1,0.75,"RP11-295M3.4,C11orf97,C12orf75,SNTN,C5orf49,GSTA1,TMEM231",Multiciliated lineage,multi-ciliated epithelial cell,CL:0005012,epithelial cell,"Ciliated, Proximal Ciliated","Ciliated, Platelet/Megakaryocyte",Ciliated,Natural Killer T
300,300,300,300,Lung,1,0.75,"MS4A1,CD37,TSC22D3,ISG20,CD79A,LTB,CORO1A",B cell lineage,B cell,CL:0000236,b cell,B,"B, Plasma, Natural Killer T, CD4+ Memory/Effector T",B,B cell
301,301,301,301,Lung,1,0.75,"CXCL17,WFDC2,PIGR,KRT19,MUC1,CEACAM6,KRT7",Secretory,secretory cell,CL:0000151,secretory cell,Goblet,"Club, Goblet, Mucous, Serous, Alveolar Epithelial Type 2, Signaling Alveolar Epithelial Type 2, Platelet/Megakaryocyte","Goblet, Mucous","Goblet, Club"
302,302,302,302,Lung,1,0.75,"CD14,S100A9,LST1,FCER1G,S100A8,VCAN,FCN1",Monocytes,monocyte,CL:0000576,macrophage/monocyte,"Macrophage, Monocyte","Capillary, Capillary Intermediate 1, Vein, Classical Monocyte, OLR1+ Classical Monocyte, Intermediate Monocyte, Nonclassical Monocyte, Macrophage, Proliferating Macrophage, IGSF21+ Dendritic, EREG+ Dendritic, TREM2+ Dendritic",Classical Monocyte,"Monocyte, Macrophage"
303,303,303,303,Lung,1,0.75,"MARCKSL1,CCL28,PIP,TCN1,SEC11C,SELM,ZG16B",Submucosal Secretory,,,secretory cell,Serous,"Differentiating Basal, Goblet, Serous, Ionocyte, Neuroendocrine, Artery, Plasma, Plasmacytoid Dendritic",Serous,"Serous, Basal"
304,304,304,304,Lung,1,0.75,"HYAL2,CDH5,PECAM1,EGFL7,CLDN5,AQP1,CLEC14A",EC capillary,capillary endothelial cell,CL:0002144,endothelial cell,Capillary,"Alveolar Epithelial Type 1, Capillary Aerocyte, Capillary, Capillary Intermediate 1, Capillary Intermediate 2, TREM2+ Dendritic, Platelet/Megakaryocyte",Capillary Aerocyte,"Endothelial, Capillary"
305,305,305,305,Lung,1,0.75,"SDPR,CLDN5,TM4SF1,RAMP2,PPFIBP1,IGFBP7,CCL21",Lymphatic EC mature,,,endothelial cell,"Plasma, Lymphatic","Club, Basal, Alveolar Epithelial Type 1, Capillary Aerocyte, Capillary Intermediate 1, Capillary Intermediate 2, Alveolar Fibroblast, Basophil/Mast 1, Basophil/Mast 2, Platelet/Megakaryocyte",Alveolar Epithelial Type 1,"Basophil/Mast, Ciliated"
306,306,306,306,Lung,1,0.75,"AKAP12,TFF3,IGFBP7,GNG11,SDPR,CCL21,TFPI",Lymphatic EC differentiating,,,endothelial cell,Capillary Aerocyte,"Capillary, Capillary Intermediate 1, Bronchial Vessel 2, Lymphatic, Airway Smooth Muscle, Adventitial Fibroblast, EREG+ Dendritic","Monocyte, Dendritic","Lymphatic, Dendritic"
307,307,307,307,Lung,1,0.75,"CORO1A,ITGB2,MS4A6A,HLA-DPA1,HLA-DQB1,GPR183,HLA-DMA",Dendritic cells,dendritic cell,CL:0000451,dendritic cell,"Myeloid Dendritic, T cell, NK cell","CD8+ Naive T, Natural Killer T, Natural Killer, Proliferating NK/T, Myeloid Dendritic Type 2, TREM2+ Dendritic, Nonclassical Monocyte, Club, Alveolar Epithelial Type 2, Signaling Alveolar Epithelial Type 2, Capillary Aerocyte, Capillary, Capillary Intermediate 1, Mesothelial, Macrophage, Proliferating Macrophage, Myeloid Dendritic Type 1, Myeloid Dendritic Type 2, IGSF21+ Dendritic, EREG+ Dendritic",Macrophage,"Mucous, Capillary Aerocyte"
308,308,308,308,Lung,1,0.75,"GPX3,SPARCL1,MT1X,TPM2,CYR61,PRELP,TAGLN",Myofibroblasts,myofibroblast cell,CL:0000186,myofibroblast cell,Smooth Muscle,"Mucous, Neuroendocrine, Artery, Vein, Capillary Aerocyte, Capillary Intermediate 1, Pericyte, Macrophage, Proliferating Macrophage, IGSF21+ Dendritic, EREG+ Dendritic, TREM2+ Dendritic, Bronchial Vessel 1, Bronchial Vessel 2, Airway Smooth Muscle, Fibromyocyte",Basophil/Mast,"Basophil/Mast, Proliferating"
309,309,309,309,Lung,1,0.75,"CPA3,TPSB2,KIT,GATA2,VWA5A,RGS13,MS4A2",Mast cells,mast cell,CL:0000097,granulocyte,Mast Cells,"Basophil/Mast 1, Basophil/Mast 2, Ionocyte, Capillary, Capillary Intermediate 1, Proximal Ciliated, Alveolar Fibroblast",Basophil/Mast,"Basophil/Mast, Epithelial"
310,310,310,310,Lung,1,0.75,"LMOD1,ACTG2,PLN,PPP1R14A,NEXN,IGFBP7,FLNA",Fibromyocytes,,,muscle cell,"Alveolar Epithelial Type 1, Airway Smooth Muscle, Vascular Smooth Muscle, Platelet/Megakaryocyte","Airway Smooth Muscle, Vascular Smooth Muscle, Fibromyocyte",Airway Smooth Muscle,Airway Smooth Muscle
311,311,311,311,Lung,1,0.75,"HMGN1,COX20,S100A16,MARCKS,ECSCR,HMGN2,TUBB",Lymphatic EC proliferating,,,endothelial cell,"Basal, Proximal Basal, Differentiating Basal, Proliferating Basal, Goblet, Lymphatic, Plasma, Macrophage, Platelet/Megakaryocyte","Proximal Basal, Differentiating Basal, Proliferating Basal, Goblet, Ionocyte, Bronchial Vessel 1, Lymphatic, Myofibroblast, Mesothelial, Proliferating NK/T, Basophil/Mast 1, Basophil/Mast 2, Platelet/Megakaryocyte, Proliferating Macrophage, Plasmacytoid Dendritic, Myeloid Dendritic Type 2",Proliferating NK/T,Basal
312,312,312,312,Lung,1,0.75,"FBXL7,KALRN,ST6GALNAC3,PKHD1L1,PPFIBP1,LDB2,MMRN1",Endothelial cell (lymphatic),endothelial cell of lymphatic vessel,CL:0002138,endothelial cell,"Lymphatic, Alveolar Epithelial Type 1, Alveolar Fibroblast","Alveolar Epithelial Type 1, Myofibroblast, Adventitial Fibroblast, Basophil/Mast 1, Basophil/Mast 2, Lymphatic",Lymphatic,Basal
313,313,313,313,Lung,1,0.75,"LMO7,KHDRBS2,RBMS3,NTM,LIMCH1,RAB11FIP1,ST6GALNAC5",Epithelial cell (alveolar type I),type I pneumocyte,CL:0002062,epithelial cell,"Alveolar Epithelial Type 1, Alveolar Epithelial Type 2","Alveolar Epithelial Type 1, Signaling Alveolar Epithelial Type 2, Vein, Alveolar Fibroblast",Alveolar Epithelial Type 1,Alveolar Epithelial Type 1
314,314,314,314,Lung,1,0.75,"SFTPC,SFTPB,MACROD2,AUTS2,LRRK2,PDE4D,ANK3",Epithelial cell (alveolar type II),type II pneumocyte,CL:0002063,epithelial cell,"Alveolar Epithelial Type 2, Signaling Alveolar Epithelial Type 2","Alveolar Epithelial Type 2, Signaling Alveolar Epithelial Type 2, Plasma, Club, Basal, Proximal Basal, Proliferating Basal, Macrophage, Classical Monocyte, Nonclassical Monocyte, Intermediate Monocyte",Alveolar Epithelial Type 2,Alveolar Epithelial Type 2
315,315,315,315,Lung,1,0.75,"SSBP2,KRT17,FAF1,TP63,XPR1,MACROD2,RBMS3",Epithelial cell (basal),basal cell,CL:0000646,stem cell,"Basal, Proximal Basal, Differentiating Basal, Proliferating Basal, Platelet/Megakaryocyte","Basal, Proximal Basal, Platelet/Megakaryocyte",Basal,Basal
316,316,316,316,Lung,1,0.75,"STK33,HYDIN,CFAP54,C4orf22,LRRIQ1,DNAH7,CDHR3",Epithelial cell (ciliated),ciliated epithelial cell,CL:0000067,epithelial cell,"Ciliated, Proximal Ciliated","Ciliated, Proximal Ciliated",Ciliated,Ciliated
